Job Title,Company Name,Job Tags / Skills,Location,Job Type,Date Posted,Job URL
Member of Product Design Digital Assets,Anchorage Digital,"iOS, Crypto, Security, Technical, Growth, Web, Financial, Finance, Bank, Strategy, Lead, Senior, Legal, Engineering",United States,N/A,N/A,https://remoteok.com/remote-jobs/remote-member-of-product-design-digital-assets-anchorage-digital-1128734
ML Solutions Architect,Provectus,"Architect, System, Security, Technical, Support, DevOps, Serverless, Cloud, API, Lead",Probably worldwide,N/A,N/A,https://remoteok.com/remote-jobs/remote-ml-solutions-architect-provectus-1128724
Software Engineer Proactive Security,DoorDash,"Security, Software, System, Support, Manager, Cloud, Lead, Engineer, Engineering",United States,N/A,N/A,https://remoteok.com/remote-jobs/remote-software-engineer-proactive-security-doordash-1128717
Senior Software Engineer Node.js,3Pillar,"Software, System, Front End, Architect, Docker, Technical, Growth, Code, Serverless, Node. JS, API, Senior, Junior, Health, Engineer, Engineering, Backend",Romania,N/A,N/A,https://remoteok.com/remote-jobs/remote-senior-software-engineer-node-js-3pillar-1128716
Senior Marketing Automation Specialist,TimelyCare,"Technical, Support, Growth, Analyst, Edu, Management, Lead, Senior, Operational, Marketing, Sales, Health","Dallas / Ft. Worth, TX",N/A,N/A,https://remoteok.com/remote-jobs/remote-senior-marketing-automation-specialist-timelycare-1128713
Frontend Software Engineer Digital Health,Oowlish Technology,"Front End, Software, System, Testing, Growth, UI, Code, Web, Quality Assurance, Git, Angular, Mobile, Health, Healthcare, Engineer, Engineering, Backend",Probably worldwide,N/A,N/A,https://remoteok.com/remote-jobs/remote-frontend-software-engineer-digital-health-oowlish-technology-1128708
Senior Software Developer,Varicent,"Developer, Software, SaaS, Leader, Management, Lead, Senior, Sales",Canada,N/A,N/A,https://remoteok.com/remote-jobs/remote-senior-software-developer-varicent-1128699
Senior Sales Engineer Commercial,ExtraHop,"Security, Technical, Support, Growth, Management, Lead, Senior, Sales, Engineer, Engineering",Upgrade to Premium to see salary,N/A,N/A,https://remoteok.com/remote-jobs/remote-senior-sales-engineer-commercial-extrahop-1128691
Senior Systems Engineer Hybrid Intelligent Systems,Flock Safety,"System, Security, Python, Full-Stack, Recruiter, Software, Cloud, Lead, Senior, Sales, Health, Engineer",Probably worldwide,N/A,N/A,https://remoteok.com/remote-jobs/remote-senior-systems-engineer-hybrid-intelligent-systems-flock-safety-1128685
Sales Development Representative,Newsela,"Training, Support, Growth, Strategy, Lead, Marketing, Sales",Remote - United States,N/A,N/A,https://remoteok.com/remote-jobs/remote-sales-development-representative-newsela-1128684
Staff People Business Partner Growth and G&A,Hazel Health,"Growth, Students, Support, Manager, Senior, Operational, Medical, Health, Healthcare",Upgrade to Premium to see salary,N/A,N/A,https://remoteok.com/remote-jobs/remote-staff-people-business-partner-growth-and-ga-hazel-health-1128682
Technical Product Manager AvaCloud,Ava Labs,"Manager, Web3, Technical, Growth, Marketing","Brooklyn, NY",N/A,N/A,https://remoteok.com/remote-jobs/remote-technical-product-manager-avacloud-ava-labs-1128673
job 24824 Junior Drupal Developer Brazil,CI&T,"Developer, Front-End, Front End, Support, Web, Drupal, Junior, Operational, Health, Healthcare",Brazil,N/A,N/A,https://remoteok.com/remote-jobs/remote-job-24824-junior-drupal-developer-brazil-ciampt-1128671
Principal Software Engineer,Coforma,"Software, GraphQL, Front-End, Back-End, Security, Training, Full-Stack, Technical, Growth, Code, Web, Travel, Voice, Manager, Cloud, API, Leader, Strategy, Management, Lead, Operations, Engineer, Engineering, Executive",#LI-Remote,N/A,N/A,https://remoteok.com/remote-jobs/remote-principal-software-engineer-coforma-1128668
Associate Creative Director,Kepler Group,"Director, 3d, Growth, Video, Investment, Leader, Marketing",San Jose,N/A,N/A,https://remoteok.com/remote-jobs/remote-associate-creative-director-kepler-group-1128665
Product Manager US,Blue Bottle Coffee,"Manager, Training, Support, Director, Finance, Strategy, Management, Content, Senior, Marketing, Excel, Sales, Ecommerce",Probably worldwide,N/A,N/A,https://remoteok.com/remote-jobs/remote-product-manager-us-blue-bottle-coffee-1128649
Product Manager,LogicGate,"Manager, Technical, Software, Cloud, Leader, Management, Senior, Reliability, Engineering",Upgrade to Premium to see salary,N/A,N/A,https://remoteok.com/remote-jobs/remote-product-manager-logicgate-1128641
Solutions Engineer Web3,Sei Labs,"Web3, Crypto, Training, Consult, Architect, Technical, Support, Financial, Lead, Engineer, Engineering",Remote / Asia,N/A,N/A,https://remoteok.com/remote-jobs/remote-solutions-engineer-web3-sei-labs-1128633
Managing Director AMER Advertising Solutions,Kochava,"Director, SaaS, Gaming, Technical, Growth, Ads, Mobile, Leader, Strategy, Management, Lead, Senior, Marketing, Sales, Executive",United States,N/A,23/12/25,https://remoteok.com/remote-jobs/remote-managing-director-amer-advertising-solutions-kochava-1129312
Finance Manager,ReFED,"Manager, Salesforce, Embedded, System, Support, Growth, Director, Travel, Accounting, Bookkeeping, Financial, Video, Edu, Management, Operational, Excel, Health, Recruitment",USA,N/A,15/12/25,https://remoteok.com/remote-jobs/remote-finance-manager-refed-1129222
Senior Accountant,Circle.so,"Accountant, Accounting, Financial, Management, Senior, Operations, Non Tech",Upgrade to Premium to see salary,N/A,12/12/25,https://remoteok.com/remote-jobs/remote-senior-accountant-circle-so-1129189
Staff Cloud Database Engineer,WeightWatchers,"Financial, Cloud, Mobile, Analytics, Health, Engineer",United States,N/A,12/12/25,https://remoteok.com/remote-jobs/remote-staff-cloud-database-engineer-weightwatchers-1129183
Engineering Manager Self Custody,Anchorage Digital,"Manager, iOS, Crypto, Security, Technical, Support, Software, Growth, Financial, Investment, Bank, Strategy, Management, Operational, Legal, Recruiting, Engineering, Full-Time",United States,Full-time,11/12/25,https://remoteok.com/remote-jobs/remote-engineering-manager-self-custody-anchorage-digital-1129172
Senior Data Engineer,Ethena Labs,"Crypto, Back-End, Python, Cto, Technical, Growth, Financial, Serverless, Cloud, Strategy, Senior, Junior, Engineer",Globally Remote,N/A,10/12/25,https://remoteok.com/remote-jobs/remote-senior-data-engineer-ethena-labs-1129163
Customer Service Specialist,Greenlight Financial Technology,"Training, Recruiter, Support, Software, Fintech, Banking, Mobile, Engineering","Atlanta, GA",N/A,N/A,https://remoteok.com/remote-jobs/remote-customer-service-specialist-greenlight-financial-technology-1129159
Onboarding Specialist,Pulley,"Technical, Growth, Management, Lead",Upgrade to Premium to see salary,N/A,N/A,https://remoteok.com/remote-jobs/remote-onboarding-specialist-pulley-1129117
Finance Project Team Lead,Avalere Health,"Training, Technical, Support, Growth, Accounting, Financial, Microsoft, Management, Lead, Operations, Marketing, Medical, Health, Healthcare",Manchester,N/A,N/A,https://remoteok.com/remote-jobs/remote-finance-project-team-lead-avalere-health-1129094
Social Media Lead,Supra,"Technical, Test, Growth, Director, Voice, Video, Leader, Strategy, Management, Lead, Content",Upgrade to Premium to see salary,N/A,N/A,https://remoteok.com/remote-jobs/remote-social-media-lead-supra-1129087
Production Code Quality Internship,Supra,"Code, Technical, Testing, Leader, Internship",Upgrade to Premium to see salary,Internship,N/A,https://remoteok.com/remote-jobs/remote-production-code-quality-internship-supra-1129063
Senior Product Manager Payments,Coinme,"Manager, Defi, Crypto, Cryptocurrency, Architect, Growth, Financial, Mobile, Lead, Senior",Upgrade to Premium to see salary,N/A,N/A,https://remoteok.com/remote-jobs/remote-senior-product-manager-payments-coinme-1129049
IT Specialist,Circle.so,"Security, Support, Operations, Non Tech",Upgrade to Premium to see salary,N/A,N/A,https://remoteok.com/remote-jobs/remote-it-specialist-circle-so-1129017
Senior Financial Analyst,Precision for Medicine,"Analyst, Cfo, Support, Director, Accountant, Financial, Senior, Operational, Executive, Non Tech","Remote, United States",N/A,N/A,https://remoteok.com/remote-jobs/remote-senior-financial-analyst-precision-for-medicine-1129013
Finance Data Analyst,Circle.so,"Analyst, Growth, Financial, Strategy, Operational, Engineering",Upgrade to Premium to see salary,N/A,N/A,https://remoteok.com/remote-jobs/remote-finance-data-analyst-circle-so-1129008
VP Protocol Engineer,Galaxy Digital Services,"Web3, Crypto, Founder, Ceo, Support, Investment, Leader, Engineer, Engineering",US,N/A,N/A,https://remoteok.com/remote-jobs/remote-vp-protocol-engineer-galaxy-digital-services-1128993
Vice President Senior Frontend Developer,Galaxy,"Front End, Developer, Web3, Crypto, Founder, Ceo, Investment, Leader, Senior",Mumbai,N/A,N/A,https://remoteok.com/remote-jobs/remote-vice-president-senior-frontend-developer-galaxy-1128977
Assoc Protocol Engineer,Galaxy Digital Services,"Web3, Crypto, Founder, Ceo, Software, DevOps, Investment, Perl, Leader, Engineer, Engineering",US,N/A,N/A,https://remoteok.com/remote-jobs/remote-assoc-protocol-engineer-galaxy-digital-services-1128893
Finance Analyst,H1,"Analyst, SaaS, System, Technical, Recruiter, Support, Director, Financial, Microsoft, Operations, Excel, Sales, Biotech, Health, Healthcare, Executive",New York,N/A,N/A,https://remoteok.com/remote-jobs/remote-finance-analyst-h1-1128835
Business Development Representative,Zone & Co,"SaaS, Software",United Kingdom,N/A,N/A,https://remoteok.com/remote-jobs/remote-business-development-representative-zone-co-1128812
Associate Director Client Finance,Collectively,"Director, Support, Financial, Lead, Non Tech","Remote, United States",N/A,N/A,https://remoteok.com/remote-jobs/remote-associate-director-client-finance-collectively-1128788
Accounts Payable Lead,Loft Orbital Solutions,"Security, Support, Software, Accounting, Accountant, Financial, Bank, Lead, Health, Healthcare, Part-Time",Remote US,Part-time,N/A,https://remoteok.com/remote-jobs/remote-accounts-payable-lead-loft-orbital-solutions-1128786
Associate Director Finance Grants & Compliance,Rocketship Public Schools,"Director, Students, Accounting, Financial, Edu, Management, Excel, Health, Educational, Non Tech",Upgrade to Premium to see salary,N/A,N/A,https://remoteok.com/remote-jobs/remote-associate-director-finance-grants-amp-compliance-rocketship-public-schools-1128785
Technical Support Manager,Metronome,"Manager, Technical, Support, Software, Growth, Lead, Operational",New York City,N/A,N/A,https://remoteok.com/remote-jobs/remote-technical-support-manager-metronome-1128753
Administrative Assistant,Cribl,"Assistant, Security, Support, Lead, Operational, Excel, Legal, Sales, Non Tech",Remote - United States,N/A,N/A,https://remoteok.com/remote-jobs/remote-administrative-assistant-cribl-1128703
Regional Vice President of Sales,"AppZen, Inc.","SaaS, Software, Growth, Leader, Lead, Senior, Sales",Probably worldwide,N/A,N/A,https://remoteok.com/remote-jobs/remote-regional-vice-president-of-sales-appzen-inc-1128659
Forward Deployed Engineer Analyst Government Services,Sayari,"Analyst, Technical, Software, Code, Financial, Investment, Engineer, Engineering",Remote - US,N/A,N/A,https://remoteok.com/remote-jobs/remote-forward-deployed-engineer-analyst-government-services-sayari-1128656
Operations Manager,Ethena Labs,"Manager, Back-End, Growth, Coo, Financial, Strategy, Management, Operations, Operational",Globally Remote,N/A,N/A,https://remoteok.com/remote-jobs/remote-operations-manager-ethena-labs-1128624
Current openings,Ava Labs,"Web3, Support, Non Tech",New York City,N/A,N/A,https://remoteok.com/remote-jobs/remote-current-openings-ava-labs-1128623
Executive Assistant,Splash Financial,"Assistant, Financial, Bank, Health, Executive",Upgrade to Premium to see salary,N/A,N/A,https://remoteok.com/remote-jobs/remote-executive-assistant-splash-financial-1128604
Customer Service,Splash Financial,"Financial, Bank, Health, Non Tech",Upgrade to Premium to see salary,N/A,N/A,https://remoteok.com/remote-jobs/remote-customer-service-splash-financial-1128598
Business Operations Manager,Alpen Labs,"Manager, Bitcoin, Coo, Financial, Investor, Rails, Operations, Operational, Legal, Non Tech",Upgrade to Premium to see salary,N/A,N/A,https://remoteok.com/remote-jobs/remote-business-operations-manager-alpen-labs-1128586
Director Finance Strategy & Operations,HighLevel,"Director, Design, SaaS, Architect, Cfo, Support, Accounting, Financial, Investor, API, Strategy, Management, Lead, Operations, Operational, Marketing, Legal, Sales, Executive",United States,N/A,N/A,https://remoteok.com/remote-jobs/remote-director-finance-strategy-amp-operations-highlevel-1128570
Senior Project Manager Finance Fuze Health,Fuze Health,"Manager, Growth, Financial, Management, Lead, Senior, Operations, Medical, Health, Healthcare",United States,N/A,N/A,https://remoteok.com/remote-jobs/remote-senior-project-manager-finance-fuze-health-fuze-health-1128568
Head of Platform Engineering,Ethena Labs,"Design, Crypto, Cryptocurrency, Back-End, Security, Technical, Support, Developer, Growth, DevOps, Financial, Cloud, Leader, Strategy, Lead, Senior, Operations, Engineer, Engineering",Globally Remote,N/A,N/A,https://remoteok.com/remote-jobs/remote-head-of-platform-engineering-ethena-labs-1128540
Customer Success Manager,Pulley,"Manager, Consultant, Growth, Management, Lead, Operations, Executive",Upgrade to Premium to see salary,N/A,N/A,https://remoteok.com/remote-jobs/remote-customer-success-manager-pulley-1128529
Engineering Manager,Fora Financial,"Manager, Code, Scrum, Financial, Lead, Legal, Engineering",Upgrade to Premium to see salary,N/A,N/A,https://remoteok.com/remote-jobs/remote-engineering-manager-fora-financial-1128520
Lead Product Manager Crypto,Galaxy,"Crypto, Manager, Web3, Founder, Ceo, Investment, Leader, Lead, Non Tech",New York City,N/A,N/A,https://remoteok.com/remote-jobs/remote-lead-product-manager-crypto-galaxy-1128499
Account Executive EU,Electrified Thermal,"Technical, Support, Growth, Lead, Marketing, Sales, Go, Engineering, Executive",EU,N/A,N/A,https://remoteok.com/remote-jobs/remote-account-executive-eu-electrified-thermal-1128484
Paralegal Capital Markets,GoodLeap,"Supervisor, Support, Developer, Software, Financial, Management, Operations, Legal","Remote, US",N/A,N/A,https://remoteok.com/remote-jobs/remote-paralegal-capital-markets-goodleap-1128481
Senior Manager Martech Developer Digital Banking,Forbright Bank,"Developer, Manager, Salesforce, Embedded, System, Wordpress, Technical, Testing, Growth, Financial, Banking, Bank, Cloud, API, Microsoft, Management, Content, Senior, Operational, Marketing",Upgrade to Premium to see salary,N/A,N/A,https://remoteok.com/remote-jobs/remote-senior-manager-martech-developer-digital-banking-forbright-bank-1128475
Director of Claims Payment & Payment Integrity Operations,Gravie,"Director, Support, Voice, Financial, Edu, Management, Lead, Operations, Operational, Health, Healthcare, Non Tech",Upgrade to Premium to see salary,N/A,N/A,https://remoteok.com/remote-jobs/remote-director-of-claims-payment-amp-payment-integrity-operations-gravie-1128472
Head of Compliance,Veda Tech Labs,"Design, Defi, Crypto, Security, Training, Technical, Support, Testing, Financial, Lead, Operations, Operational, Engineering, Executive",Upgrade to Premium to see salary,N/A,N/A,https://remoteok.com/remote-jobs/remote-head-of-compliance-veda-tech-labs-1128431
Head of Product Design,Ethena Labs,"Design, Defi, Crypto, Front End, Back-End, Ceo, Technical, Testing, Growth, UX, Financial, Animation, Strategy, Management, Lead, Senior, Marketing, Engineering, Executive",Globally Remote,N/A,N/A,https://remoteok.com/remote-jobs/remote-head-of-product-design-ethena-labs-1128418
Senior Actuarial Analyst,DoorDash USA,"Analyst, Support, Strategy, Senior, Operational, Non Tech",Upgrade to Premium to see salary,N/A,N/A,https://remoteok.com/remote-jobs/remote-senior-actuarial-analyst-doordash-usa-1128363
Senior Tax Accountant,Rithum,"Accountant, Software, Accounting, Financial, Management, Senior, Operations, Excel, Legal, Sales, E-Commerce",United States,N/A,N/A,https://remoteok.com/remote-jobs/remote-senior-tax-accountant-rithum-1128360
Manager Capital Markets,Palmetto Clean Technology,"Manager, Financial, Management, Sales, Non Tech",Remote - United States,N/A,N/A,https://remoteok.com/remote-jobs/remote-manager-capital-markets-palmetto-clean-technology-1128359
Lead Product Manager Institutional,Xapo Bank,"Manager, Architect, Strategy, Management, Lead",Gibraltar,N/A,N/A,https://remoteok.com/remote-jobs/remote-lead-product-manager-institutional-xapo-bank-1128309
Payroll & Operations Specialist,Form Health,"Payroll, Support, Adult, Video, Mobile, Operations, Operational, Medical, Health, Healthcare, Educational, Non Tech",Upgrade to Premium to see salary,N/A,N/A,https://remoteok.com/remote-jobs/remote-payroll-operations-specialist-form-health-1128301
Data Scientist Revenue,Match Group,"Senior, Analytics, Executive, Non Tech",Los Angeles,N/A,N/A,https://remoteok.com/remote-jobs/remote-data-scientist-revenue-match-group-1128299
Finance Manager,GiveDirectly,"Manager, Software, Financial, Operations",Nairobi,N/A,N/A,https://remoteok.com/remote-jobs/remote-finance-manager-givedirectly-1128285
Head of Content,Xapo Bank,"Support, Video, Bank, Leader, Management, Content, Non Tech",Gibraltar,N/A,N/A,https://remoteok.com/remote-jobs/remote-head-of-content-xapo-bank-1128243
FP&A Analyst,Xapo Bank,"Analyst, Support, Financial, Management, Non Tech",Gibraltar,N/A,N/A,https://remoteok.com/remote-jobs/remote-fpa-analyst-xapo-bank-1128241
Content Writer Marketing,Xapo Bank,"Writer, Growth, Web, SEO, Strategy, Management, Lead, Content, Marketing",Gibraltar,N/A,N/A,https://remoteok.com/remote-jobs/remote-content-writer-marketing-xapo-bank-1128240
Senior Quantitative Analyst,BHG Financial,"Analyst, Design, Training, Support, Growth, Financial, Leader, Strategy, Lead, Content, Senior, Marketing, Excel, Analytics, Healthcare",Upgrade to Premium to see salary,N/A,N/A,https://remoteok.com/remote-jobs/remote-senior-quantitative-analyst-bhg-financial-1128233
Senior Backend Developer,Wintermute,"Developer, Design, Defi, Crypto, UX, Web, Financial, Cloud, Leader, Senior, Backend",London / Remote,N/A,N/A,https://remoteok.com/remote-jobs/remote-senior-backend-developer-wintermute-1128223
Senior Staff DeFi Engineer,Ethena Labs,"Defi, Design, Solidity, Ethereum, Security, Technical, Growth, UX, Financial, Leader, Strategy, Senior, Junior, Reliability, Engineer, Engineering",Globally Remote,N/A,N/A,https://remoteok.com/remote-jobs/remote-senior-staff-defi-engineer-ethena-labs-1128222
Sales Operations Analyst,Hometap,"Analyst, Support, Fintech, Lead, Operations, Sales, Healthcare, Non Tech",Upgrade to Premium to see salary,N/A,N/A,https://remoteok.com/remote-jobs/remote-sales-operations-analyst-hometap-1128212
Senior Fullstack Engineer,Clair,"Embedded, System, Front End, Security, Architect, Technical, Support, Developer, Code, Payroll, JavaScript, Financial, Fintech, Banking, Bank, Cloud, Senior, Reliability, Engineer, Engineering, Backend, Fullstack",Upgrade to Premium to see salary,N/A,N/A,https://remoteok.com/remote-jobs/remote-senior-fullstack-engineer-clair-1128161
Senior Analyst GTM Planning & Analytics,Drata,"Analyst, SaaS, Support, Financial, Microsoft, Management, Senior, Operations, Marketing, Excel, Analytics, Sales, Health, Healthcare, Non Tech",Probably worldwide,N/A,N/A,https://remoteok.com/remote-jobs/remote-senior-analyst-gtm-planning-analytics-drata-1128159
Current openings,Splash Financial,"Financial, Non Tech",Upgrade to Premium to see salary,N/A,N/A,https://remoteok.com/remote-jobs/remote-current-openings-splash-financial-1128146
Senior Compliance Operations Specialist,Ethena Labs,"Design, Defi, Crypto, Ethereum, Support, Growth, Manager, Financial, Investor, Strategy, Senior, Operations, Operational, Legal",Globally Remote,N/A,N/A,https://remoteok.com/remote-jobs/remote-senior-compliance-operations-specialist-ethena-labs-1127839
Security Engineer,Galaxy,"Security, Web3, Crypto, Founder, Ceo, Investment, Leader, Operations, Engineer",Upgrade to Premium to see salary,N/A,N/A,https://remoteok.com/remote-jobs/remote-security-engineer-galaxy-1127837
Manager Business Intelligence,Bullish US LLC,"Manager, Design, Crypto, Security, Support, Financial, Investment, Management, Lead, Senior, Operations, Analytics",United States,N/A,N/A,https://remoteok.com/remote-jobs/remote-manager-business-intelligence-bullish-us-llc-1095763
Senior Engineer Production Operations,Greenlight Financial Technology,"System, Security, Technical, Recruiter, Support, Software, Code, Financial, Fintech, Banking, Cloud, Senior, Operations, Operational, Reliability, Health, Engineer, Engineering",Atlanta (Remote Friendly),N/A,N/A,https://remoteok.com/remote-jobs/remote-senior-engineer-production-operations-greenlight-financial-technology-1095227
Crypto Trader,Escorial Future,"Other, Crypto, Edu, Web3, Bitcoin, Junior",Part time,Part-time,N/A,https://remoteok.com/remote-jobs/remote-crypto-trader-escorial-future-1093995
Developer Relations Engineer,Arbitrum Foundation,"Developer, Web3, Cryptocurrency, Ethereum, Security, Technical, Support, Growth, Code, Edu, Content, Health, Healthcare, Engineer, Engineering, Recruitment, Educational, Full-Time",Worldwide,Full-time,N/A,https://remoteok.com/remote-jobs/remote-developer-relations-engineer-arbitrum-foundation-1093885
Director of Finance Poppy & Peonies,Bloom,"Director, Design, Founder, Architect, Ceo, Support, Growth, Accounting, Financial, Investment, Banking, Strategy, Management, Lead, Operations, Marketing, Sales, Health, Recruitment",Worldwide,N/A,N/A,https://remoteok.com/remote-jobs/remote-director-of-finance-poppy-amp-peonies-bloom-1093882
Trading Technology Engineering Manager,Ethena Labs,"Manager, Design, Defi, Crypto, Ethereum, System, Security, Technical, Software, Testing, Test, Growth, Financial, Investment, Leader, Strategy, Management, Lead, Junior, Engineering",Globally Remote,N/A,N/A,https://remoteok.com/remote-jobs/remote-trading-technology-engineering-manager-ethena-labs-1093875
Account Executive,Cority,"SaaS, Training, Consulting, Support, Software, Growth, Microsoft, Management, Operational, Legal, Sales, Health, Executive",United Kingdom,N/A,N/A,https://remoteok.com/remote-jobs/remote-account-executive-cority-1093873
Smart Contract Engineer,Aragon,"Design, Osx, Web3, Defi, Solidity, Ethereum, Security, Technical, Support, Developer, Software, Growth, Management, Go, Engineer, Engineering",Worldwide,Contract,N/A,https://remoteok.com/remote-jobs/remote-smart-contract-engineer-aragon-1093858
Senior DevOps Engineer,Echo Base,"Web3, Crypto, Cryptocurrency, System, Swift, Security, Technical, DevOps, Lambda, Cloud, Leader, Strategy, Senior, Operations, Operational, Engineer, Apache",Probably worldwide,N/A,N/A,https://remoteok.com/remote-jobs/remote-senior-devops-engineer-echo-base-1093825
Data Analyst,P2P. org,"Analyst, Defi, Crypto, System, Consultancy, Technical, Support, Growth, API, Health",Delhi,N/A,N/A,https://remoteok.com/remote-jobs/remote-data-analyst-p2p-org-1093806
Senior Staff Security Engineer,Ethena Labs,"Security, Defi, Crypto, Ethereum, Full-Stack, Technical, Software, Testing, Growth, DevOps, Financial, Strategy, Senior, Engineer, Engineering",Globally Remote,N/A,N/A,https://remoteok.com/remote-jobs/remote-senior-staff-security-engineer-ethena-labs-1093805
Strategy Manager,Coins.ph,"Manager, Web3, Crypto, Cryptocurrencies, Support, Growth, Financial, Mobile, Strategy, Management, Operational",Philippines,N/A,N/A,https://remoteok.com/remote-jobs/remote-strategy-manager-coins-ph-1093798
Developer Relations Engineer,Arbitrum Foundation,"Developer, Web3, Cryptocurrency, Ethereum, Security, Technical, Growth, Code, Edu, Content, Health, Healthcare, Engineer, Engineering, Recruitment, Educational, Full-Time",Europe,Full-time,N/A,https://remoteok.com/remote-jobs/remote-developer-relations-engineer-arbitrum-foundation-1093781
Technical Writer,Peach Finance,"System, Training, Technical, Writer, Developer, Financial, Video, API, Management, Content, Senior, Marketing",Worldwide,N/A,N/A,https://remoteok.com/remote-jobs/remote-technical-writer-peach-finance-1093765
Growth Marketing Lead,Anchorage Digital,"Growth, Crypto, Security, Testing, Financial, Bank, Leader, Management, Lead, Marketing, Analytics, Legal, Engineering",United States,N/A,N/A,https://remoteok.com/remote-jobs/remote-growth-marketing-lead-anchorage-digital-1093752
Product Manager,PancakeSwap,"Manager, Non Tech",Upgrade to Premium to see salary,N/A,N/A,https://remoteok.com/remote-jobs/remote-product-manager-pancakeswap-1129483
AEP Enterprise Architect,Jobgether,"Architect, Amazon, System, Consulting, Technical, Growth, Web, Travel, Cloud, Microsoft, Leader, Management, Lead, Senior, Engineering, Executive",Ireland,N/A,N/A,https://remoteok.com/remote-jobs/remote-aep-enterprise-architect-jobgether-1129482
Content and Communications Lead,Recidiviz,"Support, Software, Lead, Content",Upgrade to Premium to see salary,N/A,06/01/26,https://remoteok.com/remote-jobs/remote-content-and-communications-lead-recidiviz-1129447
Account Manager,Digible,"Manager, Analytics, Non Tech",Upgrade to Premium to see salary,N/A,06/01/26,https://remoteok.com/remote-jobs/remote-account-manager-digible-1129441
Content Marketing Manager,CertiK,"Manager, Web3, Security, Technical, Support, Growth, SEO, Strategy, Management, Content, Excel, Sales, Full-Time",US / Remote,Full-time,05/01/26,https://remoteok.com/remote-jobs/remote-content-marketing-manager-certik-1129407
