Job Title,Company Name,Job Tags / Skills,Location,Job Type,Date Posted,Job URL
Head of Paid Search,Wpromote,"Security, Support, Growth, Financial, Edu, Investment, Strategy, Management, Lead, Content, Operational, Recruiting, Executive","Remote, United States",N/A,05/01/26,https://remoteok.com/remote-jobs/remote-head-of-paid-search-wpromote-1129406
Marketing & Sponsorship Coordinator,Assist World,"Coordinator, Support, Content, Sales, Non Tech",Probably worldwide,N/A,02/01/26,https://remoteok.com/remote-jobs/remote-marketing-amp-sponsorship-coordinator-assist-world-1129393
Regional Director Public Sector Sales DOW,Chainguard,"Director, Security, Software, Cloud, Management, Sales",Washington DC,N/A,01/01/26,https://remoteok.com/remote-jobs/remote-regional-director-public-sector-sales-dow-chainguard-1129388
Client Success Executive Wayforge,SBI Growth,"Consulting, Growth, Management, Executive",Upgrade to Premium to see salary,N/A,30/12/25,https://remoteok.com/remote-jobs/remote-client-success-executive-wayforge-sbi-growth-1129381
Senior Amazon Brand Manager,GNO Partners,Sales,Worldwide,N/A,26/12/25,https://remoteok.com/remote-jobs/remote-senior-amazon-brand-manager-gno-partners-1129050
Growth Marketing Manager,InfStones,"Growth, Manager, Web3, Node, Mobile, Management, Analytics, Sales, Full-Time",Texas,Full-time,24/12/25,https://remoteok.com/remote-jobs/remote-growth-marketing-manager-infstones-1129333
SEC Reporting Manager,HighLevel,"Manager, Technical, Support, Accounting, Financial, Edu, Investor, API, Management, Legal, Sales",United States,N/A,23/12/25,https://remoteok.com/remote-jobs/remote-sec-reporting-manager-highlevel-1129317
Associate Medical Writer,Precision AQ,"Writer, Support, Edu, Content, Legal, Non Tech","Remote, United States",N/A,23/12/25,https://remoteok.com/remote-jobs/remote-associate-medical-writer-precision-aq-1129315
Web Analyst Web Data and Analytics,Best Egg,"Web, Analyst, Technical, Testing, Growth, Director, Financial, Strategy, Management, Lead, Analytics, Health",Remote / Flexible,N/A,23/12/25,https://remoteok.com/remote-jobs/remote-web-analyst-web-data-and-analytics-best-egg-1129310
SaaS Growth Marketer,Land Insights,"SaaS, Full Time, SEO, Content Writing, Ads",Worldwide,Full-time,20/12/25,https://remoteok.com/remote-jobs/remote-saas-growth-marketer-land-insights-1129007
Marketing Strategist,OneLocal,"SaaS, Consult, Technical, Strategist, SEO, Management, Content, Analytics, Branding",Upgrade to Premium to see salary,N/A,19/12/25,https://remoteok.com/remote-jobs/remote-marketing-strategist-onelocal-1129288
Lead Medical Writer Medical Communications,Avalere Health,"Training, Consultancy, Writer, Support, Growth, Lead, Content, Junior, Medical, Health, Healthcare",Probably worldwide,N/A,19/12/25,https://remoteok.com/remote-jobs/remote-lead-medical-writer-medical-communications-avalere-health-1129286
Senior Product Marketing Manager Cloud Security,"Tenable, Inc.","Security, Manager, Technical, Support, Cloud, Strategy, Management, Lead, Content, Senior, Sales",Columbia,N/A,18/12/25,https://remoteok.com/remote-jobs/remote-senior-product-marketing-manager-cloud-security-tenable-inc-1129284
Product Marketing Manager,Shakepay,"Manager, Bitcoin, Financial, Non Tech","Remote, Canada",N/A,18/12/25,https://remoteok.com/remote-jobs/remote-product-marketing-manager-shakepay-1129279
Community Manager,"Manta Network, Powered by p0x labs","Manager, Web3, Crypto, Growth, Voice, Content, Analytics",any,N/A,18/12/25,https://remoteok.com/remote-jobs/remote-community-manager-manta-network-powered-by-p0x-labs-1129272
Graphic Designer,Waterfall,"NFT, Designer, Travel, Content",Upgrade to Premium to see salary,N/A,17/12/25,https://remoteok.com/remote-jobs/remote-graphic-designer-waterfall-1129269
AP Principal US Market Access based role,Avalere Health,"Training, Consulting, Support, Growth, Manager, Financial, Strategy, Management, Content, Senior, Junior, Sales, Medical, Health, Healthcare",Probably worldwide,N/A,17/12/25,https://remoteok.com/remote-jobs/remote-ap-principal-us-market-access-based-role-avalere-health-1129260
Commercial Account Representative,Illumio,"Security, Support, Travel, Financial, Leader, Management, Operational, Sales, Recruitment, Executive, Non Tech",Upgrade to Premium to see salary,N/A,16/12/25,https://remoteok.com/remote-jobs/remote-commercial-account-representative-illumio-1129249
Business Intelligence Analyst,RainFocus,"Analyst, Software, Health",Lehi,N/A,16/12/25,https://remoteok.com/remote-jobs/remote-business-intelligence-analyst-rainfocus-1129246
Events Marketing Manager,Alpaca,"Manager, Crypto, Developer, Financial, Investment, C, API, Strategy, Executive",Remote - North America or South America,N/A,16/12/25,https://remoteok.com/remote-jobs/remote-events-marketing-manager-alpaca-1129242
Digital Marketing Manager Online Opportunity,mindmoneyreset,"Manager, System, Students, Training, Support, Leader, Sales",Probably worldwide,N/A,13/12/25,https://remoteok.com/remote-jobs/remote-digital-marketing-manager-online-opportunity-mindmoneyreset-1129215
Leadership Development Associate,Lifestyle Seed Consulting,"Consulting, Training, Support, Growth, Edu",Probably worldwide,N/A,13/12/25,https://remoteok.com/remote-jobs/remote-leadership-development-associate-lifestyle-seed-consulting-1129210
Digital Marketing & Client Outreach Consultant,Blue Shed Group,"Consultant, Training, Support, Content, Non Tech",Probably worldwide,N/A,13/12/25,https://remoteok.com/remote-jobs/remote-digital-marketing-amp-client-outreach-consultant-blue-shed-group-1129209
Proposal Manager,UltraViolet Cyber,"Manager, Security, Support, Microsoft, Strategy, Management, Content, Operations, Executive, Non Tech",Upgrade to Premium to see salary,N/A,12/12/25,https://remoteok.com/remote-jobs/remote-proposal-manager-ultraviolet-cyber-1129182
Manager Community Events and Engagement,American Marketing Association,"Manager, Students, Training, Non Tech",Upgrade to Premium to see salary,N/A,12/12/25,https://remoteok.com/remote-jobs/remote-manager-community-events-and-engagement-american-marketing-association-1129178
Product Manager,Conduit,"Manager, Web3, Crypto, Ethereum, Ceo, Technical, Developer, Growth, Cloud, Strategy, Lead, Operations, Engineering",Probably worldwide,N/A,10/12/25,https://remoteok.com/remote-jobs/remote-product-manager-conduit-1129162
Senior Product Manager E Commerce,Ollie,"Manager, Technical, Support, Growth, Scrum, Leader, Lead, Senior, Health, Engineering, Ecommerce, E-Commerce, Shopify",Upgrade to Premium to see salary,N/A,N/A,https://remoteok.com/remote-jobs/remote-senior-product-manager-e-commerce-ollie-1129138
Digital Specialist Paid Social,Community Boost,"Support, Testing, Ads, Strategy, Analytics, Non Tech",Upgrade to Premium to see salary,N/A,N/A,https://remoteok.com/remote-jobs/remote-digital-specialist-paid-social-community-boost-1129116
Client Success Portfolio Manager,Included Health,"Manager, Recruiter, Support, Growth, Director, Travel, Strategy, Lead, Content, Senior, Medical, Health, Healthcare, Executive, Full-Time",Upgrade to Premium to see salary,Full-time,N/A,https://remoteok.com/remote-jobs/remote-client-success-portfolio-manager-included-health-1129077
Education Specialist,Berni Mick Ireland,"Teacher, Teaching, Growth, Edu, Leader, Lead",Probably worldwide,N/A,N/A,https://remoteok.com/remote-jobs/remote-education-specialist-berni-mick-ireland-1129073
Growth Marketing Manager,InfStones,"Growth, Manager, Web3, Node, Mobile, Management, Analytics, Sales, Full-Time",Texas,Full-time,N/A,https://remoteok.com/remote-jobs/remote-growth-marketing-manager-infstones-1129065
Leadership Development Director Independent &,Lifestyle Seed Consulting,"Consulting, Director, Students, Training, Support, Growth, Edu, Content",Probably worldwide,N/A,N/A,https://remoteok.com/remote-jobs/remote-leadership-development-director-independent-amp-lifestyle-seed-consulting-1129024
Strategic Account Executive,Saviynt,"SaaS, Security, Training, Growth, Cloud, Mobile, Leader, Management, Lead, Operational, Sales, Executive",Boston,N/A,N/A,https://remoteok.com/remote-jobs/remote-strategic-account-executive-saviynt-1129002
Technical Content Writer & Knowledge Specialist,Skio,"Training, Technical, Writer, Support, CSS, Content, Analytics, Engineering, Shopify",Upgrade to Premium to see salary,N/A,N/A,https://remoteok.com/remote-jobs/remote-technical-content-writer-amp-knowledge-specialist-skio-1128995
Full Stack Engineer,Darkroom,"React, Technical, Software, Code, DevOps, Cloud, Junior, Engineer, Engineering",New York,N/A,N/A,https://remoteok.com/remote-jobs/remote-full-stack-engineer-darkroom-1128975
Data Analyst,Blockchain.com,"Analyst, Crypto, Technical, Support, Software, Financial, Operations",Paris,N/A,N/A,https://remoteok.com/remote-jobs/remote-data-analyst-blockchain-com-1128938
Marketing Specialist,INFUSE,"Security, Support, Test, Manager, Video, Recruiting, Non Tech",Upgrade to Premium to see salary,N/A,N/A,https://remoteok.com/remote-jobs/remote-marketing-specialist-infuse-1128936
Intern CPR Awareness & Project Management,Jobgether,"Students, Training, Support, Management, Content, Operational, Legal, Health, Recruitment, Internship, Non Tech",Probably worldwide,Internship,N/A,https://remoteok.com/remote-jobs/remote-intern-cpr-awareness-project-management-jobgether-1128911
Growth Marketing Manager,InfStones,"Growth, Manager, Web3, Node, Mobile, Management, Analytics, Sales, Full-Time",Texas,Full-time,N/A,https://remoteok.com/remote-jobs/remote-growth-marketing-manager-infstones-1128883
Associate Principal Principal US Market Access,Avalere Health,"Training, Support, Growth, Management, Lead, Senior, Junior, Medical, Health, Healthcare",Probably worldwide,N/A,N/A,https://remoteok.com/remote-jobs/remote-associate-principal-principal-us-market-access-avalere-health-1128880
Director Pharma Activation Success,NimbleRx,"Director, Support, Voice, Investment, Management, Lead, Operations, Sales, Health, Healthcare, Non Tech",Upgrade to Premium to see salary,N/A,N/A,https://remoteok.com/remote-jobs/remote-director-pharma-activation-success-nimblerx-1128875
Senior Manager Marketing Compliance,Chime,"Manager, Leader, Strategy, Lead, Senior, Full-Time, Non Tech","San Francisco, CA",Full-time,N/A,https://remoteok.com/remote-jobs/remote-senior-manager-marketing-compliance-chime-1128855
Marketing Operations Strategist,Power Digital,"Consulting, Strategist, Testing, Growth, Investment, Content, Operations",Remote - Argentina,N/A,N/A,https://remoteok.com/remote-jobs/remote-marketing-operations-strategist-power-digital-1128854
Marketing Operations Strategist,Power Digital,"Consulting, Strategist, Testing, Growth, Investment, Content, Operations",Costa Rica,N/A,N/A,https://remoteok.com/remote-jobs/remote-marketing-operations-strategist-power-digital-1128853
EMEA Sales Development Representative,AppFollow,"Software, Growth, Lead, Sales",Europe,N/A,N/A,https://remoteok.com/remote-jobs/remote-emea-sales-development-representative-appfollow-1128846
Regional Sales Manager South East,JuneShine Brands,"Manager, Growth, Travel, Leader, Strategy, Management, Lead, Sales, Go","Tampa, FL",N/A,N/A,https://remoteok.com/remote-jobs/remote-regional-sales-manager-south-east-juneshine-brands-1128845
Senior Manager of Marketing Programs,Lumin Digital,"Manager, SaaS, Technical, Financial, Fintech, Banking, Cloud, Strategy, Management, Senior, Operations, Operational, Analytics, Sales",Remote- United States,N/A,N/A,https://remoteok.com/remote-jobs/remote-senior-manager-of-marketing-programs-lumin-digital-1128836
Marketing Operations Project Manager,TerrAscend,"Manager, Amazon, Security, Recruiter, Support, Software, Director, Adult, Financial, Microsoft, Management, Operations, Excel, Legal, Health, Recruiting",Upgrade to Premium to see salary,N/A,N/A,https://remoteok.com/remote-jobs/remote-marketing-operations-project-manager-terrascend-1128829
CRM Content Writer EMEA,Medier,"Writer, Testing, Content, Non Tech",Upgrade to Premium to see salary,N/A,N/A,https://remoteok.com/remote-jobs/remote-crm-content-writer-emea-medier-1128828
Account Manager,doola,"Manager, Support, Growth, Voice, Financial, Management, Operational, Sales",Probably worldwide,N/A,N/A,https://remoteok.com/remote-jobs/remote-account-manager-doola-1128821
Account Manager Paid Search,Monks,"Manager, Management, Non Tech",Upgrade to Premium to see salary,N/A,N/A,https://remoteok.com/remote-jobs/remote-account-manager-paid-search-monks-1128817
Field & Event Marketing Manager,AppOmni,"Manager, SaaS, Security, Travel, Management, Sales, Non Tech","Remote, USA",N/A,N/A,https://remoteok.com/remote-jobs/remote-field-event-marketing-manager-appomni-1128801
Client Partner Ads Sales,Aleph,"Consulting, Support, Growth, Ads, Management, Sales, Go",Probably worldwide,N/A,N/A,https://remoteok.com/remote-jobs/remote-client-partner-ads-sales-aleph-1128795
Manager Mid Market Sales,Greenhouse,"Manager, Strategist, Director, Leader, Strategy, Lead, Senior, Sales, Go, Non Tech",Anywhere in the United States,N/A,N/A,https://remoteok.com/remote-jobs/remote-manager-mid-market-sales-greenhouse-1128794
Inside Sales Associate,Liatrio,"Consulting, Software, Growth, DevOps, Financial, Lead, Senior, Sales, Healthcare, Engineering",Upgrade to Premium to see salary,N/A,N/A,https://remoteok.com/remote-jobs/remote-inside-sales-associate-liatrio-1128791
VP Oncology Clinical Solutions,Precision Medicine Group,"Training, Support, Edu, Leader, Operational, Non Tech","Remote, United States",N/A,N/A,https://remoteok.com/remote-jobs/remote-vp-oncology-clinical-solutions-precision-medicine-group-1128774
Growth Consultant LATAM,Ava Labs,"Consultant, Growth, Web3, Architect, Developer, Lead, Operations, Operational",LATAM,N/A,N/A,https://remoteok.com/remote-jobs/remote-growth-consultant-latam-ava-labs-1128768
Regional Sales Manager Southeast,JuneShine Brands,"Manager, Growth, Travel, Leader, Strategy, Management, Lead, Sales, Go","Charlotte, NC",N/A,N/A,https://remoteok.com/remote-jobs/remote-regional-sales-manager-southeast-juneshine-brands-1128757
Trade Marketing Manager Texas,JuneShine Brands,"Manager, Growth, Travel, Strategy, Management, Lead, Operations, Marketer, Analytics, Sales, Go, Executive","Austin, TX",N/A,N/A,https://remoteok.com/remote-jobs/remote-trade-marketing-manager-texas-juneshine-brands-1128756
National Account Manager South,JuneShine Brands,"Manager, Growth, Travel, Adult, Strategy, Management, Lead, Sales, Go","Orlando, FL",N/A,N/A,https://remoteok.com/remote-jobs/remote-national-account-manager-south-juneshine-brands-1128755
Account Manager m f d,Phiture,"Manager, Consultancy, Growth, Director, Quality Assurance, Mobile, Lead, Senior, Operational",Upgrade to Premium to see salary,N/A,N/A,https://remoteok.com/remote-jobs/remote-account-manager-m-f-d-phiture-1128746
Sales Coordinator m f d,Phiture,"Consultancy, Coordinator, Support, Growth, Mobile, Management, Sales",Upgrade to Premium to see salary,N/A,N/A,https://remoteok.com/remote-jobs/remote-sales-coordinator-m-f-d-phiture-1128745
Business Development Representative,Recorded Future,"Technical, Sales, Executive",Florida,N/A,N/A,https://remoteok.com/remote-jobs/remote-business-development-representative-recorded-future-1128740
Project Manager,Avalere Health,"Manager, System, Training, Technical, Support, Software, Growth, Accounting, Financial, Lead, Analytics, Medical, Health, Healthcare",Probably worldwide,N/A,N/A,https://remoteok.com/remote-jobs/remote-project-manager-avalere-health-1128729
Sales Executive Brazil,Megaport,"Training, Technical, Growth, Code, Travel, Voice, Cloud, Microsoft, Leader, Senior, Sales, Recruitment, Executive",Brazil,N/A,N/A,https://remoteok.com/remote-jobs/remote-sales-executive-brazil-megaport-1128723
Director Demand Generation,Engine,"Director, Support, Travel, Fintech, Strategy, Management, Lead, Non Tech",Remote - USA,N/A,N/A,https://remoteok.com/remote-jobs/remote-director-demand-generation-engine-1128720
Business Development Manager,Kafene,"Manager, Software, Growth, Fintech, Microsoft, Management, Operations, Excel, Sales","Pittsburgh, PA",N/A,N/A,https://remoteok.com/remote-jobs/remote-business-development-manager-kafene-1128705
Key Account Manager,Quad Lock,"Manager, Training, Game, Support, Travel, Microsoft, Management, Legal, Sales, Branding, Educational, Non Tech",Probably worldwide,N/A,N/A,https://remoteok.com/remote-jobs/remote-key-account-manager-quad-lock-1128704
Marketing Systems and Analytics Manager,TimelyCare,"Manager, SaaS, System, Technical, Support, Growth, Financial, Edu, Strategy, Management, Lead, Analytics, Sales, Health","Dallas / Ft. Worth, TX",N/A,N/A,https://remoteok.com/remote-jobs/remote-marketing-systems-and-analytics-manager-timelycare-1128702
Medical Writer,Precision Medicine Group,"Training, Writer, Support, Edu, Content, Non Tech","Remote, United States",N/A,N/A,https://remoteok.com/remote-jobs/remote-medical-writer-precision-medicine-group-1128687
Automation Engineer Contract,Goodway Group,"Security, Consulting, Operational, Reliability, Engineer",Upgrade to Premium to see salary,Contract,N/A,https://remoteok.com/remote-jobs/remote-automation-engineer-contract-goodway-group-1128683
Technical Writer Contract,Legion Intelligence,"Technical, Writer, Support, Video, API, Content, Reliability",Upgrade to Premium to see salary,Contract,N/A,https://remoteok.com/remote-jobs/remote-technical-writer-contract-legion-intelligence-1128662
Account Executive,Influ2,"Salesforce, Support, Software, Travel, Sales, Health, Executive",United States,N/A,N/A,https://remoteok.com/remote-jobs/remote-account-executive-influ2-1128655
Commercial Sales Manager,Triple Whale,"Manager, SaaS, Growth, Lead, Operational, Analytics, Sales, Ecommerce",Remote US,N/A,N/A,https://remoteok.com/remote-jobs/remote-commercial-sales-manager-triple-whale-1128651
Director Demand Generation US,Seamless.AI,"Director, SaaS, Growth, Strategy, Lead, Sales",United States,N/A,N/A,https://remoteok.com/remote-jobs/remote-director-demand-generation-us-seamless-ai-1128589
Paid Social Growth Marketer Consultant,Right Side Up,"Consultant, Growth, Test, Ads, Strategy, Marketer","Austin, TX",N/A,N/A,https://remoteok.com/remote-jobs/remote-paid-social-growth-marketer-consultant-right-side-up-1128578
Full Stack Developer,Bisnow,"Developer, Design, Front-End, Back-End, Technical, Software, Code, Web, Sales, Go, Recruitment",Upgrade to Premium to see salary,N/A,N/A,https://remoteok.com/remote-jobs/remote-full-stack-developer-bisnow-1128563
Field Sales Representative field based Dallas Fort Worth Texas,Liquid Death,"Growth, Travel, Sales, Health",Dallas-Fort Worth,N/A,N/A,https://remoteok.com/remote-jobs/remote-field-sales-representative-field-based-dallas-fort-worth-texas-liquid-death-1128562
Graphic Designer,SupplyHouse.com,"Designer, Growth, Manager, E-Commerce",Upgrade to Premium to see salary,N/A,N/A,https://remoteok.com/remote-jobs/remote-graphic-designer-supplyhouse-com-1128541
Creative Producer,PIP Labs,"Design, API, Management, Operational, Legal",US,N/A,N/A,https://remoteok.com/remote-jobs/remote-creative-producer-pip-labs-1128525
Partner Marketing Manager,Honeycomb,"Manager, Developer",Remote - United States,N/A,N/A,https://remoteok.com/remote-jobs/remote-partner-marketing-manager-honeycomb-1128523
Junior Copywriter,NPHub,"Copywriter, Wordpress, Students, Architect, Support, Copywriting, Voice, SEO, Strategy, Management, Content, Senior, Junior, Health, Healthcare",Colombia - Remote,N/A,N/A,https://remoteok.com/remote-jobs/remote-junior-copywriter-nphub-1128521
BUSINESS DEVELOPMENT DIRECTOR,Wishpond Technologies,"Director, Design, SaaS, Training, Support, Software, Growth, Edu, Leader, Management, Lead, Senior, Operations, Operational, Sales, Executive, Full-Time",Philippines,Full-time,N/A,https://remoteok.com/remote-jobs/remote-business-development-director-wishpond-technologies-1128518
Growth Marketing Specialist,PolicyMe,"Growth, Support, Director, Financial, Video, Operations, Health",Remote in Toronto,N/A,N/A,https://remoteok.com/remote-jobs/remote-growth-marketing-specialist-policyme-1128513
Customer Marketing Manager,Vimeo,"Manager, Design, SaaS, Software, Growth, Director, Video, Content, Senior",New York,N/A,N/A,https://remoteok.com/remote-jobs/remote-customer-marketing-manager-vimeo-1128507
Manager Healthcare Partnerships Medicare Advantage,Mom's Meals,"Manager, Salesforce, Training, Consulting, Support, Growth, Travel, Microsoft, Leader, Strategy, Operational, Sales, Health, Healthcare","Ankeny, IA",N/A,N/A,https://remoteok.com/remote-jobs/remote-manager-healthcare-partnerships-medicare-advantage-mom39s-meals-1128487
Sales Manager Higher Education,Talentus,"Manager, Design, SaaS, Training, Software, Growth, Edu, Management, Lead, Sales, Executive",Probably worldwide,N/A,N/A,https://remoteok.com/remote-jobs/remote-sales-manager-higher-education-talentus-1128474
Performance Creative Designer & Editor,Allara Health,"Designer, Support, Medical, Health, Healthcare","Remote, US",N/A,N/A,https://remoteok.com/remote-jobs/remote-performance-creative-designer-editor-allara-health-1128470
Senior Scientific Associate Market Access Marketing,Precision AQ,"Technical, Content, Senior, Excel",Upgrade to Premium to see salary,N/A,N/A,https://remoteok.com/remote-jobs/remote-senior-scientific-associate-market-access-marketing-precision-aq-1128457
QA Lead,Allata,"Jira, SaaS, Security, Consulting, Architect, Testing, Test, UI, Quality Assurance, Cloud, API, Strategy, Lead, Analytics, Sales, Reliability, Engineering",Argentina,N/A,N/A,https://remoteok.com/remote-jobs/remote-qa-lead-allata-1128443
Senior Territory Sales Manager,Revinate,"Manager, SaaS, Software, Director, Senior, Sales",United States,N/A,N/A,https://remoteok.com/remote-jobs/remote-senior-territory-sales-manager-revinate-1128441
Senior Full Stack Software Engineer Financial Reports Team,Houzz,"Software, Design, SaaS, Technical, Support, Developer, Test, UX, Code, Web, Financial, Management, Lead, Senior, Engineer, Backend",Nepal,N/A,N/A,https://remoteok.com/remote-jobs/remote-senior-full-stack-software-engineer-financial-reports-team-houzz-1128438
Salesforce Full Stack Developer,Culligan Quench,"Salesforce, Developer, Design, HR, System, Architect, Technical, Software, Director, Code, Web, Travel, DevOps, Financial, Banking, Java, Ruby, Leader, Management, Lead, Senior, Junior, Health, Engineering",Probably worldwide,N/A,N/A,https://remoteok.com/remote-jobs/remote-salesforce-full-stack-developer-culligan-quench-1128435
Growth Product Designer,Tradeify,"Growth, Design, Esports, System, Designer, Testing, Test, UI, UX, Director, Web, Manager, Financial, Fintech, Microsoft, Senior, Analytics, Recruitment",Worldwide,N/A,N/A,https://remoteok.com/remote-jobs/remote-growth-product-designer-tradeify-1128420
Front End Developer Sr,Valtech,"Developer, Design, Software, Senior",Brazil,N/A,N/A,https://remoteok.com/remote-jobs/remote-front-end-developer-sr-valtech-1128402
Inside Customer Support Specialist,AltaML,"SaaS, Training, Support, Software, Growth, Voice, Strategy, Management, Content, Analytics",Calgary,N/A,N/A,https://remoteok.com/remote-jobs/remote-inside-customer-support-specialist-altaml-1128399
Senior Account Manager Healthcare & Payers,CookUnity,"Manager, Training, Strategy, Lead, Senior, Sales, Healthcare, Non Tech",United States,N/A,N/A,https://remoteok.com/remote-jobs/remote-senior-account-manager-healthcare-payers-cookunity-1128398
Senior Data Analyst,Cribl,"Analyst, Security, Technical, Senior, Operational, Analytics, Reliability",Remote - United States,N/A,N/A,https://remoteok.com/remote-jobs/remote-senior-data-analyst-cribl-1128393
Web & Generative SEO Specialist,BlueCat,"Web, Design, Front-End, Technical, Testing, DevOps, Financial, Cloud, SEO, Strategy, Management, Content, Analytics, Health",Ontario - Remote,N/A,N/A,https://remoteok.com/remote-jobs/remote-web-amp-generative-seo-specialist-bluecat-1128388
Senior Manager Paid Search,Ollie,"Manager, Testing, Test, Growth, Director, Microsoft, Leader, Strategy, Management, Lead, Senior, Junior, Health",Upgrade to Premium to see salary,N/A,N/A,https://remoteok.com/remote-jobs/remote-senior-manager-paid-search-ollie-1128383
Manager of Global Sales Development Team,Gurobi Optimization,"Manager, Training, Support, Growth, Strategy, Management, Lead, Operations, Sales, Recruitment",United States,N/A,N/A,https://remoteok.com/remote-jobs/remote-manager-of-global-sales-development-team-gurobi-optimization-1128381
Commerce Writer,BDG,"Writer, Copywriting, Management, Content, Sales, Part-Time, Non Tech",Upgrade to Premium to see salary,Part-time,N/A,https://remoteok.com/remote-jobs/remote-commerce-writer-bdg-1128379
Marketing Operations Manager Global,Alpen Labs,"Manager, Bitcoin, Financial, Rails, Strategy, Content, Operations, Operational, Non Tech",Upgrade to Premium to see salary,N/A,N/A,https://remoteok.com/remote-jobs/remote-marketing-operations-manager-global-alpen-labs-1128371
Product & Research Communications,Runway,"Design, Content, Executive",Upgrade to Premium to see salary,N/A,N/A,https://remoteok.com/remote-jobs/remote-product-research-communications-runway-1128370
Data Engineer,Whatnot,"Design, Python, Technical, Support, Software, Growth, Cloud, Operational, Engineer, Engineering, E-Commerce",Probably worldwide,N/A,N/A,https://remoteok.com/remote-jobs/remote-data-engineer-whatnot-1128362
Manager of Merchandising Managers,Spreetail,"Manager, Support, Growth, Management, Lead, Operational, Health, Recruitment, Executive, Ecommerce",Probably worldwide,N/A,N/A,https://remoteok.com/remote-jobs/remote-manager-of-merchandising-managers-spreetail-1128357
Marketing & Fundraising Associate,The Trevor Project,"Management, Content, Non Tech",Remote - Mexico,N/A,N/A,https://remoteok.com/remote-jobs/remote-marketing-amp-fundraising-associate-the-trevor-project-1128356
