Job Title,Company Name,Job Tags / Skills,Location,Job Type,Date Posted,Job URL
Full Stack Product Engineer,Jiga,"Senior, JavaScript, React, Node, Mongo, Full Stack",United States,N/A,04/01/26,https://remoteok.com/remote-jobs/remote-full-stack-product-engineer-jiga-1129403
DevSecOps Engineer,Alpaca,"Design, Crypto, Security, Software, Financial, Investment, C, Cloud, API, Lead, Engineering",Remote - Global (Anywhere),N/A,N/A,https://remoteok.com/remote-jobs/remote-devsecops-engineer-alpaca-1129484
Crypto Production Engineer,Wormhole Foundation,"Crypto, Security, Support, Operational, Reliability",Upgrade to Premium to see salary,N/A,N/A,https://remoteok.com/remote-jobs/remote-crypto-production-engineer-wormhole-foundation-1129480
Product Engineer AuthKit,WorkOS,"SaaS, Support, Developer, Software, Growth, API, Health, Healthcare, Recruiting, Engineering, Recruitment",Probably worldwide,N/A,N/A,https://remoteok.com/remote-jobs/remote-product-engineer-authkit-workos-1129477
Software Engineer Mid level API,CoinGecko,"Software, Design, Cryptocurrency, Front-End, Back-End, Technical, Code, Web, Quality Assurance, Financial, Edu, Cloud, API, Leader, Junior, Engineering",Malaysia,N/A,08/01/26,https://remoteok.com/remote-jobs/remote-software-engineer-mid-level-api-coingecko-1129472
Software Engineer Site Reliability Engineer,Thumbtack,"Software, Design, Support, Developer, Code, Reliability, Engineering, Linux, Backend","Remote, Ontario",N/A,08/01/26,https://remoteok.com/remote-jobs/remote-software-engineer-site-reliability-engineer-thumbtack-1129471
Senior Software Engineer .NET US,PerfectServe,"Software, Technical, Growth, Voice, Senior, Healthcare",Upgrade to Premium to see salary,N/A,08/01/26,https://remoteok.com/remote-jobs/remote-senior-software-engineer-net-us-perfectserve-1129470
Senior Software Engineer,Evolve,"Software, Design, System, Technical, Support, Code, Leader, Lead, Senior, Operations, Operational, Sales, Engineering, Backend",Remote - US,N/A,08/01/26,https://remoteok.com/remote-jobs/remote-senior-software-engineer-evolve-1129469
Senior Staff Machine Learning Engineer,Cresta,"Front-End, Senior","US, Canada",N/A,07/01/26,https://remoteok.com/remote-jobs/remote-senior-staff-machine-learning-engineer-cresta-1129468
Staff Software Engineer Java,Ping Identity,"Software, Developer, Java, Cloud, Management","Vancouver, WA",N/A,07/01/26,https://remoteok.com/remote-jobs/remote-staff-software-engineer-java-ping-identity-1129467
Principal Server Engineer NBA 2K,Visual Concepts,"Design, Game, Technical, Support, Software, Engineering, Backend","Novato, CA",N/A,07/01/26,https://remoteok.com/remote-jobs/remote-principal-server-engineer-nba-2k-visual-concepts-1129466
Software Engineer iOS,Mercury,"iOS, Software, Financial, Banking, Bank, Mobile, Android, Backend",Remote within Canada or United States,N/A,07/01/26,https://remoteok.com/remote-jobs/remote-software-engineer-ios-mercury-1129465
Senior Server Engineer NBA 2K,Visual Concepts,"Security, Game, Gaming, Software, Code, Video, C++, Microsoft, Senior, Go, Backend","Novato, CA",N/A,07/01/26,https://remoteok.com/remote-jobs/remote-senior-server-engineer-nba-2k-visual-concepts-1129464
Senior Software Engineer Analytics,"Bayesian Health, Inc.","Software, Python, Technical, Support, Cloud, Lead, Senior, Analytics, Biotech, Health, Healthcare, Engineering",Probably worldwide,N/A,07/01/26,https://remoteok.com/remote-jobs/remote-senior-software-engineer-analytics-bayesian-health-inc-1129463
Software Engineer,Tech Solutions Inc.,"Software, Code, Java",San Francisco,N/A,07/01/26,https://remoteok.com/remote-jobs/remote-software-engineer-tech-solutions-inc-1129462
Quality Assurance Engineer Manual,Elligint Health,"Testing, Test, Medical, Health, Healthcare",Upgrade to Premium to see salary,N/A,07/01/26,https://remoteok.com/remote-jobs/remote-quality-assurance-engineer-manual-elligint-health-1129457
Senior Technical Support Engineer,Motive,"Training, Technical, Support, Senior, Engineering",Upgrade to Premium to see salary,N/A,07/01/26,https://remoteok.com/remote-jobs/remote-senior-technical-support-engineer-motive-1129456
Staff Software Engineer Crypto,Robinhood,"Crypto, Software, Design, Cryptocurrency, System, Security, Technical, Support, Financial, Finance, Lead, Junior, Engineering",New York,N/A,06/01/26,https://remoteok.com/remote-jobs/remote-staff-software-engineer-crypto-robinhood-1129455
Owner IT Support Engineer,Owner,Support,Upgrade to Premium to see salary,N/A,06/01/26,https://remoteok.com/remote-jobs/remote-owner-it-support-engineer-owner-1129452
Lead Omics Workflow Engineer,Axle,"Software, Assistant, Lead, Health, Healthcare, Educational",Upgrade to Premium to see salary,N/A,06/01/26,https://remoteok.com/remote-jobs/remote-lead-omics-workflow-engineer-axle-1129445
Copy of Senior AI ML Engineer Applied Machine Learning,Trase Systems,Senior,USA,N/A,06/01/26,https://remoteok.com/remote-jobs/remote-copy-of-senior-ai-ml-engineer-applied-machine-learning-trase-systems-1129443
Senior Software Engineer Backend Engineering,Trase Systems,"Software, Senior, Engineering, Backend",Upgrade to Premium to see salary,N/A,06/01/26,https://remoteok.com/remote-jobs/remote-senior-software-engineer-backend-engineering-trase-systems-1129442
Senior Software Engineer Frontend Engineering,Trase Systems,"Front End, Software, Senior, Engineering",Upgrade to Premium to see salary,N/A,06/01/26,https://remoteok.com/remote-jobs/remote-senior-software-engineer-frontend-engineering-trase-systems-1129440
Software Engineer Agent Infrastructure,OpenAI,"Software, Design, System, Security, Training, Technical, Cloud, Engineering",Probably worldwide,N/A,05/01/26,https://remoteok.com/remote-jobs/remote-software-engineer-agent-infrastructure-openai-1129438
Software Engineer,Tech Solutions Inc.,"Software, Web",San Francisco,N/A,05/01/26,https://remoteok.com/remote-jobs/remote-software-engineer-tech-solutions-inc-1129437
Senior Backend PHP Software Engineer Inventory,Cloudbeds,"Software, SaaS, Amazon, Web, PHP, Strategy, Senior, Operations, Backend",Minnesota,N/A,05/01/26,https://remoteok.com/remote-jobs/remote-senior-backend-php-software-engineer-inventory-cloudbeds-1129436
Senior Backend PHP Software Engineer Inventory,Cloudbeds,"Software, SaaS, Amazon, Web, PHP, Strategy, Senior, Operations, Backend",Michigan,N/A,05/01/26,https://remoteok.com/remote-jobs/remote-senior-backend-php-software-engineer-inventory-cloudbeds-1129435
Senior Backend PHP Software Engineer Inventory,Cloudbeds,"Software, SaaS, Amazon, Web, PHP, Strategy, Senior, Operations, Backend",Massachusetts,N/A,05/01/26,https://remoteok.com/remote-jobs/remote-senior-backend-php-software-engineer-inventory-cloudbeds-1129434
Site Reliability Engineer,Bobsled,"Technical, Operational, Analytics, Reliability, Engineering",US/Canada,N/A,05/01/26,https://remoteok.com/remote-jobs/remote-site-reliability-engineer-bobsled-1129429
Full Stack Software Engineer,Memberup.com,N/A,United States,Contract,04/01/26,https://remoteok.com/remote-jobs/remote-full-stack-software-engineer-memberup-com-1128227
Associate Technical Support Engineer,Recharge,"Technical, Support",Upgrade to Premium to see salary,N/A,03/01/26,https://remoteok.com/remote-jobs/remote-associate-technical-support-engineer-recharge-1129400
Senior Software Engineer,Bugcrowd,"Software, Design, Security, Cloud, API, Senior, Engineering",India,N/A,03/01/26,https://remoteok.com/remote-jobs/remote-senior-software-engineer-bugcrowd-1129399
Staff Software Engineer,Malt,"Software, Design, Technical, Support, Code, Java, Cloud, Strategy, Lead, Senior, Operational, Excel, Engineering, Backend",France,N/A,03/01/26,https://remoteok.com/remote-jobs/remote-staff-software-engineer-malt-1129398
Staff Software Engineer Money,Galileo Financial Technologies,"Software, Finance, Financial, Banking, Excel, Analytics, Engineering",New York City,N/A,01/01/26,https://remoteok.com/remote-jobs/remote-staff-software-engineer-money-galileo-financial-technologies-1129390
Senior Cloud Engineer,ClickHouse,"Security, Architect, C, Cloud, Senior",United States,N/A,01/01/26,https://remoteok.com/remote-jobs/remote-senior-cloud-engineer-clickhouse-1129389
Senior Staff AI Software Engineer,Aegis Ventures,"Software, Python, Technical, Growth, Senior, Operational, Health, Healthcare, Backend","Remote, U.S.",N/A,01/01/26,https://remoteok.com/remote-jobs/remote-senior-staff-ai-software-engineer-aegis-ventures-1129387
Member of Technical Staff Fullstack Engineer,Inflection AI,"Technical, Support, Engineering, Backend, Fullstack",Palo Alto,N/A,31/12/25,https://remoteok.com/remote-jobs/remote-member-of-technical-staff-fullstack-engineer-inflection-ai-1129384
Staff Software Engineer Simulation,Muon Space,"Software, Design, System, Web, Cloud, API, Operations, Engineering",San Jose,N/A,31/12/25,https://remoteok.com/remote-jobs/remote-staff-software-engineer-simulation-muon-space-1129383
Software Engineer Networking Software and Services,xAI,"Software, Support, Travel, Reliability, Engineering",Upgrade to Premium to see salary,N/A,30/12/25,https://remoteok.com/remote-jobs/remote-software-engineer-networking-software-and-services-xai-1129382
Senior Software Engineer,Chainguard,"Software, Design, Cloud, Management, Senior, Go, Engineering, Backend",Upgrade to Premium to see salary,N/A,30/12/25,https://remoteok.com/remote-jobs/remote-senior-software-engineer-chainguard-1129375
Senior Infrastructure Engineer,Paradigm Health,"Security, DevOps, Cloud, Senior, Medical, Healthcare, Engineering",Remote - United States,N/A,29/12/25,https://remoteok.com/remote-jobs/remote-senior-infrastructure-engineer-paradigm-health-1129369
Commercial Sales Engineer Central,Chainguard,"Security, Technical, Support, Serverless, Cloud, Sales",United States,N/A,29/12/25,https://remoteok.com/remote-jobs/remote-commercial-sales-engineer-central-chainguard-1129359
Senior Backend Software Engineer,Teleport,"Software, Security, Recruiter, Code, Edu, Cloud, Senior, Go, Health, Engineering, Linux, Backend",United States,N/A,28/12/25,https://remoteok.com/remote-jobs/remote-senior-backend-software-engineer-teleport-1129355
DevOps Software Engineer Energy Storage,Redwood Materials,"Software, Growth, Web, DevOps, Operations",San Francisco,N/A,27/12/25,https://remoteok.com/remote-jobs/remote-devops-software-engineer-energy-storage-redwood-materials-1129354
Frontend Engineer Trading Platform,MyFunded Futures,"Front End, Design, Test, Code, Financial, API, Backend",Upgrade to Premium to see salary,N/A,27/12/25,https://remoteok.com/remote-jobs/remote-frontend-engineer-trading-platform-myfunded-futures-1129351
Frontend Product Engineer,Mento,"Front End, Design, Growth, Engineering",Upgrade to Premium to see salary,N/A,27/12/25,https://remoteok.com/remote-jobs/remote-frontend-product-engineer-mento-1129349
Cloud Full Stack Python Software Engineer US,"Railroad19, Inc","Python, Software, React, Technical, Code, Serverless, Cloud, NoSQL, Angular, Health, Engineering, Full-Time",U.S. Remote,Full-time,27/12/25,https://remoteok.com/remote-jobs/remote-cloud-full-stack-python-software-engineer-us-railroad19-inc-1129344
Staff Software Engineer Backend with Close 10 years of experience,Outreach,"Software, Design, Technical, Code, Microsoft, Senior, Sales, Backend",Hyderabad,N/A,26/12/25,https://remoteok.com/remote-jobs/remote-staff-software-engineer-backend-with-close-10-years-of-experience-outreach-1129341
Full Stack Engineer Contacts,Calendly,"Design, SaaS, React, Front-End, Technical, Software, Growth, Web, Cloud, Node. JS, Engineering, Backend",Remote - US,N/A,25/12/25,https://remoteok.com/remote-jobs/remote-full-stack-engineer-contacts-calendly-1129339
Product Security Engineer DeFi,FalconX,"Defi, Security, Design, Crypto, Cryptocurrency, Support, Code, Financial, Finance, Management, Engineering",New York City,N/A,25/12/25,https://remoteok.com/remote-jobs/remote-product-security-engineer-defi-falconx-1129337
Senior Frontend Engineer,Arize AI,"Front End, React, Typescript, API, Senior, Junior, Engineering, Backend",Upgrade to Premium to see salary,N/A,25/12/25,https://remoteok.com/remote-jobs/remote-senior-frontend-engineer-arize-ai-1129336
The SafetyWing Digital Nomad Residency,SafetyWing,"Senior, Technical, Design, Sales, Marketing, Testing, Finance, SaaS, Consulting, Other",Worldwide,Temporary,18/12/25,https://remoteok.com/remote-jobs/remote-the-safetywing-digital-nomad-residency-safetywing-1129278
Site Reliability Engineer,Wormhole Foundation,"Security, Support, Operational, Reliability",Upgrade to Premium to see salary,N/A,24/12/25,https://remoteok.com/remote-jobs/remote-site-reliability-engineer-wormhole-foundation-1129335
Senior Data Engineer,Nansen.ai,"Crypto, Software, Senior, Operational, Analytics, Engineering","Remote EMEA, Remote Asia",N/A,24/12/25,https://remoteok.com/remote-jobs/remote-senior-data-engineer-nansen-ai-1129332
Senior Full Stack Engineer,Teleport,"Design, Security, Recruiter, Support, Code, Voice, Edu, Investment, Typescript, Senior, Go, Health, Engineering",United States,N/A,24/12/25,https://remoteok.com/remote-jobs/remote-senior-full-stack-engineer-teleport-1129330
Software Engineer C,Octo Horizon,"Technical, Cloud, Developer",Worldwide,N/A,23/12/25,https://remoteok.com/remote-jobs/remote-software-engineer-c-octo-horizon-1128583
Senior Analytics Engineer,Alpaca,"Crypto, Technical, Support, Financial, Investment, Finance, C, API, Senior, Operations, Operational, Marketing, Analytics, Executive",Remote - North America,N/A,23/12/25,https://remoteok.com/remote-jobs/remote-senior-analytics-engineer-alpaca-1129325
Software engineer,Sticker Mule,"Developer, Docker, Postgres, Redis, GCP, Kubernetes",Remote,N/A,23/12/25,https://remoteok.com/remote-jobs/remote-software-engineer-sticker-mule-1093738
Software Engineer Infrastructure,xAI,"Software, Engineering",Palo Alto,N/A,22/12/25,https://remoteok.com/remote-jobs/remote-software-engineer-infrastructure-xai-1129309
Senior Data Engineer,HugeInc,"Support, Senior, Engineering",United States,N/A,22/12/25,https://remoteok.com/remote-jobs/remote-senior-data-engineer-hugeinc-1129308
Performance Application Engineer Intelligent Factory,Intrinsic,"System, Technical, Software, Testing, Test, C++, Robotics, Strategy, Lead, Reliability",Mountain View,N/A,22/12/25,https://remoteok.com/remote-jobs/remote-performance-application-engineer-intelligent-factory-intrinsic-1129307
Staff Software Engineer Backend,Leona Health,"Software, Python, Cto, Technical, Strategy, Medical, Health, Engineering, Backend",San Francisco,N/A,22/12/25,https://remoteok.com/remote-jobs/remote-staff-software-engineer-backend-leona-health-1129305
AI Engineer,Magna Legal Services,"Support, Legal",Upgrade to Premium to see salary,N/A,22/12/25,https://remoteok.com/remote-jobs/remote-ai-engineer-magna-legal-services-1129304
Data Engineer,Sayari,"Python, Software, Code, Financial, Investment, Scala, Engineering",Remote - US,N/A,22/12/25,https://remoteok.com/remote-jobs/remote-data-engineer-sayari-1129302
Senior DevOps Engineer,Little Thinking Minds,"Security, Students, Architect, Technical, Support, DevOps, Cloud, Lead, Senior, Junior, Operational",Amman,N/A,20/12/25,https://remoteok.com/remote-jobs/remote-senior-devops-engineer-little-thinking-minds-1129296
Senior Research Engineer OLMo,The Allen Institute for Artificial Intelligence,"Senior, Excel, Engineering","Seattle, WA",N/A,20/12/25,https://remoteok.com/remote-jobs/remote-senior-research-engineer-olmo-the-allen-institute-for-artificial-intelligence-1129294
TypeScript Developer,Stoke Studio,"Backend, JavaScript, Node, Typescript, GraphQL, Postgres, AI, Developer",United States,N/A,13/12/25,https://remoteok.com/remote-jobs/remote-typescript-developer-stoke-studio-1129195
Full Stack Software Engineer III Angular Java,MeridianLink,"Software, Design, Front-End, Back-End, Full-Stack, Technical, Support, Testing, UI, Code, Web, DevOps, Java, Angular, Lead, Senior, Junior",Probably worldwide,N/A,19/12/25,https://remoteok.com/remote-jobs/remote-full-stack-software-engineer-iii-angular-java-meridianlink-1129290
Software Engineer,Field Nation,"Software, SaaS, React, Docker, Technical, Support, Growth, Web, PHP, HTML, Git, MySQL, Node. JS, Mobile, Engineering, Linux",Dhaka,N/A,19/12/25,https://remoteok.com/remote-jobs/remote-software-engineer-field-nation-1129287
Platform Security Engineer,Braze,"Security, Growth, Engineering",Bucharest,N/A,19/12/25,https://remoteok.com/remote-jobs/remote-platform-security-engineer-braze-1129285
Software Engineer Integrations,Deposco,"Software, Design, SaaS, Amazon, Front-End, Back-End, UI, Web, Java, MySQL, API, Management, Health, Engineering, Apache, E-Commerce",Alpharetta,N/A,18/12/25,https://remoteok.com/remote-jobs/remote-software-engineer-integrations-deposco-1129282
Software Engineer III,MeridianLink,"Software, Design, C#, React, System, Technical, Web, Senior",Probably worldwide,N/A,17/12/25,https://remoteok.com/remote-jobs/remote-software-engineer-iii-meridianlink-1129270
Senior Software Engineer Trading Technology,BitMEX,"Software, Crypto, Cryptocurrency, Security, Senior",Remote - EMEA,N/A,17/12/25,https://remoteok.com/remote-jobs/remote-senior-software-engineer-trading-technology-bitmex-1129267
Software Engineer I Dev Tooling,Sumo Logic,"Software, Design, System, Technical, Support, Developer, Code, Web, JavaScript, Strategy, Senior, Engineering",Noida,N/A,17/12/25,https://remoteok.com/remote-jobs/remote-software-engineer-i-dev-tooling-sumo-logic-1129266
Distributed Systems Engineer,LiveKit,"Design, Technical, Support, Developer, Cloud, Operational, Reliability, Engineering",Probably worldwide,N/A,17/12/25,https://remoteok.com/remote-jobs/remote-distributed-systems-engineer-livekit-1129265
Analytics Engineer,Socure,"Design, Technical, Support, Management, Analytics, Reliability, Recruiting, Engineering",Carson City,N/A,17/12/25,https://remoteok.com/remote-jobs/remote-analytics-engineer-socure-1129263
Security Compliance Specialist,LiveKit,"Security, Technical, Support, Software, Code, Management, Lead, Operations, Operational, Engineering, Full-Time",Probably worldwide,Full-time,17/12/25,https://remoteok.com/remote-jobs/remote-security-compliance-specialist-livekit-1129262
Overnight Customer Support Engineer,"Rebuy, Inc.","SaaS, Front End, Ceo, Technical, Recruiter, Support, Software, Testing, Test, Coo, Scrum, Manager, JavaScript, HTML, Lead, Legal, Ecommerce",Probably worldwide,N/A,17/12/25,https://remoteok.com/remote-jobs/remote-overnight-customer-support-engineer-rebuy-inc-1129261
Senior Security Engineer,Loft Orbital Solutions,"Security, Design, Software, Growth, Code, Financial, Senior, Operations, Health, Healthcare, Engineering","Golden, CO or San Francisco",N/A,17/12/25,https://remoteok.com/remote-jobs/remote-senior-security-engineer-loft-orbital-solutions-1129258
Solution Engineer Inside Sales Support,Illumio,"Salesforce, Security, Game, Technical, Support, Software, Financial, Cloud, Microsoft, Leader, Operational, Sales, Health, Recruitment, Executive",Upgrade to Premium to see salary,N/A,16/12/25,https://remoteok.com/remote-jobs/remote-solution-engineer-inside-sales-support-illumio-1129248
Software Engineer II Golang,Stacklok,"Software, Design, System, Front End, Code, Management, Golang, Backend",Remote: Spain,N/A,16/12/25,https://remoteok.com/remote-jobs/remote-software-engineer-ii-golang-stacklok-1129245
Senior Web Scraping Engineer Python,Oxylabs,"Python, Web, System, Front-End, Back-End, Support, CSS, Senior, Go",Poland,N/A,16/12/25,https://remoteok.com/remote-jobs/remote-senior-web-scraping-engineer-python-oxylabs-1129243
Senior Backend Developer,Global Tech Services Solutions,"SaaS, Developer",Europe,Contract,N/A,https://remoteok.com/remote-jobs/remote-senior-backend-developer-global-tech-services-solutions-1129152
Java Software Engineer,capital.com,"Software, Design, Security, Code, Financial, Java, Operations, Reliability, Engineering, Backend",Probably worldwide,N/A,16/12/25,https://remoteok.com/remote-jobs/remote-java-software-engineer-capital-com-1129241
Staff Software Engineer,Shakepay,"Software, Bitcoin, Financial","Remote, Canada",N/A,16/12/25,https://remoteok.com/remote-jobs/remote-staff-software-engineer-shakepay-1129240
Senior Infrastructure Engineer Core Systems,Quicknode,"Design, Web3, Technical, Support, Cloud, Management, Senior, Operational, Go, Engineering",Lisbon,N/A,15/12/25,https://remoteok.com/remote-jobs/remote-senior-infrastructure-engineer-core-systems-quicknode-1129232
Staff Software Engineer,NMI,"Software, Design, C#, Technical, Support, Code, Microsoft, Junior, Operational, Reliability, Engineering, Backend","Remote, US",N/A,15/12/25,https://remoteok.com/remote-jobs/remote-staff-software-engineer-nmi-1129230
Security Engineer Cloud Security,Red Cell Partners,"Security, Software, Cloud, Management, Excel, Engineering","Seattle, WA",N/A,15/12/25,https://remoteok.com/remote-jobs/remote-security-engineer-cloud-security-red-cell-partners-1129229
Senior Software Engineer Platform,Omada Health,"Software, Design, Technical, Support, DevOps, Cloud, Senior, Operational, Medical, Health, Healthcare, Engineering","Remote, USA",N/A,15/12/25,https://remoteok.com/remote-jobs/remote-senior-software-engineer-platform-omada-health-1129228
Senior Platform Infrastructure Engineer II,Braze,"Growth, Cloud, Senior, Operational, Engineering",New York City,N/A,15/12/25,https://remoteok.com/remote-jobs/remote-senior-platform-infrastructure-engineer-ii-braze-1129226
Support Engineer,HumanSignal,"Training, Technical, Support, Test, Engineering",Remote Europe or East Coast North America,N/A,15/12/25,https://remoteok.com/remote-jobs/remote-support-engineer-humansignal-1129225
Senior DevOps Engineer,Inkitt,"Redis, System, Security, Support, DevOps, Elasticsearch, C, Cloud, PostgreSQL, Senior, Analytics, Reliability, Backend",Remote Mexico City,N/A,15/12/25,https://remoteok.com/remote-jobs/remote-senior-devops-engineer-inkitt-1129224
Staff Protocol Engineer EVM,Ava Labs,"Web3, Code, Engineering","Brooklyn, NY",N/A,15/12/25,https://remoteok.com/remote-jobs/remote-staff-protocol-engineer-evm-ava-labs-1129223
Senior Systems Engineer Software,2100 NVIDIA USA,"Software, Front End, Technical, Support, Test, Code, Cloud, API, Leader, Senior, Golang, Engineering, Backend","US, CA, Remote",N/A,14/12/25,https://remoteok.com/remote-jobs/remote-senior-systems-engineer-software-2100-nvidia-usa-1129220
Software Engineer Infrastructure Supercomputing,xAI,"Software, Security, Training, Cloud, Engineering",Palo Alto,N/A,13/12/25,https://remoteok.com/remote-jobs/remote-software-engineer-infrastructure-supercomputing-xai-1129217
Staff DevOps Engineer,Heartflow,"3d, Test, DevOps, Management, Healthcare",San Francisco,N/A,13/12/25,https://remoteok.com/remote-jobs/remote-staff-devops-engineer-heartflow-1129216
Offensive Security Engineer Agent Security,OpenAI,"Security, Front End, Technical, Software, Testing, UI, Code, Web, Cloud, Strategy, Operations, Operational, Reliability, Engineering, Linux",Probably worldwide,N/A,13/12/25,https://remoteok.com/remote-jobs/remote-offensive-security-engineer-agent-security-openai-1129207
Security Engineer Cloud Security,Trase Systems,"Security, Cloud",USA,N/A,13/12/25,https://remoteok.com/remote-jobs/remote-security-engineer-cloud-security-trase-systems-1129199
Senior Frontend Developer,Sanctuary Computer,"Senior, Executive, Developer, Front End",Worldwide,Contract,12/12/25,https://remoteok.com/remote-jobs/remote-senior-frontend-developer-sanctuary-computer-1129194
Trading Technology Engineer,BitMEX,"Crypto, Cryptocurrency, Security",Remote - Asia,N/A,12/12/25,https://remoteok.com/remote-jobs/remote-trading-technology-engineer-bitmex-1129191
Junior Crypto Analyst & Trader,WhiteBridge-Ltd,"Finance, Crypto, Edu, Junior, Analyst, Web3, Blockchain, Defi, Ethereum, Bitcoin, Other, Virtual Assistant",Worldwide,Part-time,07/01/26,https://remoteok.com/remote-jobs/remote-junior-crypto-analyst-trader-whitebridge-ltd-1129461
Art Director,Digital Media Management,"Director, Design, Training, Software, Growth, Video, Cloud, Strategy, Management, Lead, Marketing, Health, Illustrator",United States,N/A,06/01/26,https://remoteok.com/remote-jobs/remote-art-director-digital-media-management-1129446
Social Media Manager Platform,Digital Media Management,"Manager, Training, Copywriting, Growth, Video, Strategy, Management, Content, Marketing, Analytics, Health",United States,N/A,30/12/25,https://remoteok.com/remote-jobs/remote-social-media-manager-platform-digital-media-management-1129377
Associate Clinical Director Oncology,Private Health Management,"Director, Manager, Management, Lead, Go, Medical, Health, Healthcare",Upgrade to Premium to see salary,N/A,27/12/25,https://remoteok.com/remote-jobs/remote-associate-clinical-director-oncology-private-health-management-1129346
Senior Brand Designer,garden3d,"Design, Senior",Worldwide,Contract,10/12/25,https://remoteok.com/remote-jobs/remote-senior-brand-designer-garden3d-1129164
Senior Full Stack Developer,Best Online Traffic School,"Senior, Full Time, PHP, Laravel, Developer, Front End",Worldwide,Full-time,N/A,https://remoteok.com/remote-jobs/remote-senior-full-stack-developer-best-online-traffic-school-1129158
Senior Analytics Engineer GTM,Bitwise Asset Management,"Crypto, Support, Manager, Financial, Lead, Senior, Marketing, Analytics, Sales, Engineer, Engineering",Upgrade to Premium to see salary,N/A,N/A,https://remoteok.com/remote-jobs/remote-senior-analytics-engineer-gtm-bitwise-asset-management-1128448
Accelerator Design & Development Manager,InStride,"Manager, Edu, Lead, Educational",Los Angeles,N/A,08/01/26,https://remoteok.com/remote-jobs/remote-accelerator-design-development-manager-instride-1129473
