Job Title,Company Name,Job Tags / Skills,Location,Job Type,Date Posted,Job URL
Graphic Design Technical Mentor,ALX Africa,"Students, Training, Technical, Software",Upgrade to Premium to see salary,N/A,07/01/26,https://remoteok.com/remote-jobs/remote-graphic-design-technical-mentor-alx-africa-1129459
Junior Software Developer Full Stack,KOHO,"Developer, Software, React, Rabbitmq, Front End, Docker, Support, Code, Web, JavaScript, Financial, Cloud, Git, PostgreSQL, Angular, API, Mobile, Senior, Junior, Operations, Operational, Go, Recruitment, Backend",Probably worldwide,N/A,06/01/26,https://remoteok.com/remote-jobs/remote-junior-software-developer-full-stack-koho-1129454
Senior Product Designer Ticketing,PlayOn,"System, Teach, Students, Designer, Technical, Web, Mobile, Leader, Strategy, Management, Lead, Senior, Marketing, Reliability, Health, Full-Time, Part-Time",Upgrade to Premium to see salary,Full-time,06/01/26,https://remoteok.com/remote-jobs/remote-senior-product-designer-ticketing-playon-1129450
AI Developer 1551,Highstreet,"Developer, Technical, Support, Software, Test, Edu, Cloud, Microsoft, Senior, Operational, Sales, Reliability, Engineering",United States,N/A,06/01/26,https://remoteok.com/remote-jobs/remote-ai-developer-1551-highstreet-1129439
Associate Growth Marketer API,CoinGecko,"Growth, Cryptocurrency, Support, Financial, Edu, SEO, API, Leader, Content, Marketer, Marketing, Analytics, Internship",Malaysia,Internship,05/01/26,https://remoteok.com/remote-jobs/remote-associate-growth-marketer-api-coingecko-1129430
Product Designer,Ahrefs,"Designer, Technical, Software, Manager, Lead, Senior, Marketing, Sales, Engineering, Recruitment",Upgrade to Premium to see salary,N/A,29/12/25,https://remoteok.com/remote-jobs/remote-product-designer-ahrefs-1129366
Senior Business Analyst,Xpansiv,"Analyst, System, Security, Technical, Recruiter, Support, Testing, Manager, Edu, Microsoft, Management, Lead, Senior, Operational, Recruiting",Upgrade to Premium to see salary,N/A,29/12/25,https://remoteok.com/remote-jobs/remote-senior-business-analyst-xpansiv-1129361
Motion Designer,Alpaca,"Crypto, Designer, Technical, UI, Web, Financial, Video, Investment, C, API, Mobile",Remote - North America,N/A,29/12/25,https://remoteok.com/remote-jobs/remote-motion-designer-alpaca-1129357
Social Media Content Specialist,AllTrails,"Support, Growth, Video, Edu, Investment, Content",Upgrade to Premium to see salary,N/A,29/12/25,https://remoteok.com/remote-jobs/remote-social-media-content-specialist-alltrails-1129356
Business Systems Analyst,NASA Federal Credit Union,"Analyst, System, Training, Technical, Support, Software, Investment, Microsoft, Management, Junior, Operational, Part-Time",Upgrade to Premium to see salary,Part-time,27/12/25,https://remoteok.com/remote-jobs/remote-business-systems-analyst-nasa-federal-credit-union-1129353
Internal Controls & Policy Adherence Testing Analyst,CloudWalk,"Testing, Analyst, Technical, Support, Test, Financial, Operations, Operational, Engineering",United States,Internship,27/12/25,https://remoteok.com/remote-jobs/remote-internal-controls-amp-policy-adherence-testing-analyst-cloudwalk-1129350
Content Manager,Terra,"Manager, Writer, Support, UX, SEO, Leader, Strategy, Lead, Content, Senior, Marketing, Health, Healthcare",U.S.,N/A,27/12/25,https://remoteok.com/remote-jobs/remote-content-manager-terra-1129347
Product Manager GeckoTerminal,CoinGecko,"Manager, Crypto, Cryptocurrency, Support, Software, Test, Growth, Voice, Financial, Edu, Leader, Marketing",Malaysia,N/A,23/12/25,https://remoteok.com/remote-jobs/remote-product-manager-geckoterminal-coingecko-1129326
BIM Modeler,Sanctuary,"System, 3d, Consultant, Consulting, Technical, Support, Test, Management, Lead, Engineering",New Delhi,N/A,23/12/25,https://remoteok.com/remote-jobs/remote-bim-modeler-sanctuary-1129323
Vice President Commercial & Channel Sales,DNSFilter,"Support, Growth, Manager, Lead, Marketing, Sales, Full-Time",Upgrade to Premium to see salary,Full-time,23/12/25,https://remoteok.com/remote-jobs/remote-vice-president-commercial-channel-sales-dnsfilter-1129313
Senior GenAI Technical Lead Partner Platforms,2100 NVIDIA USA,"Technical, Support, Software, Growth, Cloud, Leader, Strategy, Lead, Senior, Engineering","US, CA, Santa Clara",N/A,21/12/25,https://remoteok.com/remote-jobs/remote-senior-genai-technical-lead-partner-platforms-2100-nvidia-usa-1129300
Operations Recruiter,Field AI,"Technical, Recruiter, Support, Software, Financial, Finance, Robotics, Management, Senior, Operations, Analytics, Sales, Go, Recruiting, Executive","Irvine, CA",N/A,19/12/25,https://remoteok.com/remote-jobs/remote-operations-recruiter-field-ai-1129291
Product Owner Payments,Flex,"SaaS, Security, Support, Growth, Financial, Finance, Fintech, Banking, Mobile, Management, Operations, Operational, Analytics, Legal, Engineering",Remote / USA,N/A,18/12/25,https://remoteok.com/remote-jobs/remote-product-owner-payments-flex-1129273
Member of Technical Staff Atlas,Anchorage Digital,"Crypto, Cryptocurrency, System, Security, Technical, Software, Testing, Growth, Code, Manager, Financial, Finance, Bank, C++, Cloud, API, Legal, Engineering, Backend",United States,N/A,17/12/25,https://remoteok.com/remote-jobs/remote-member-of-technical-staff-atlas-anchorage-digital-1129259
Full Stack Software Engineer,CompassX Group,"Software, React, Front End, Full-Stack, Architect, Technical, Support, Growth, Code, Lead, Junior, Engineer, Backend",Remote - CST Timezone,N/A,12/12/25,https://remoteok.com/remote-jobs/remote-full-stack-software-engineer-compassx-group-1129186
Senior Communications Manager,Ambience Healthcare,"Manager, SaaS, Training, Growth, Strategy, Management, Lead, Senior, Marketing, Health, Medical, Healthcare, Recruiting, Executive",San Francisco,N/A,11/12/25,https://remoteok.com/remote-jobs/remote-senior-communications-manager-ambience-healthcare-1129173
Cloud Architect NodeJs React,3Pillar,"React, Architect, SaaS, Technical, Software, Growth, Code, DevOps, Serverless, Node JS, Cloud, Typescript, Leader, Strategy, Management, Health, Engineering, Backend",India,N/A,N/A,https://remoteok.com/remote-jobs/remote-cloud-architect-nodejs-react-3pillar-1129146
Software Engineer Noho Labs,8VC,"Software, Embedded, Designer, Growth, Admin, Operations, Analytics, Health, Engineer, Engineering, Full-Time",Probably worldwide,Full-time,N/A,https://remoteok.com/remote-jobs/remote-software-engineer-noho-labs-8vc-1129144
Data Migration Engineer,Mark43,"Cloud, Engineer",Probably worldwide,N/A,N/A,https://remoteok.com/remote-jobs/remote-data-migration-engineer-mark43-1129143
Backend Engineer Unichain,Uniswap Labs,"Defi, Crypto, Ethereum, System, Technical, Code, Web, Cloud, API, Reliability, Engineer, Engineering, Backend",New York,N/A,N/A,https://remoteok.com/remote-jobs/remote-backend-engineer-unichain-uniswap-labs-1129115
Product Designer,OnePay,"Embedded, System, Designer, Manager, Financial, Fintech, Mobile, Health",Probably worldwide,N/A,N/A,https://remoteok.com/remote-jobs/remote-product-designer-onepay-1129110
Senior Strategic Partnerships Manager,Jobgether,"Manager, Growth, Senior, Operational",US,N/A,N/A,https://remoteok.com/remote-jobs/remote-senior-strategic-partnerships-manager-jobgether-1129108
Revenue Operations & Sales Lead,Playlab,"System, Students, Software, Growth, Edu, Strategy, Lead, Operations, Sales, Executive",Probably worldwide,N/A,N/A,https://remoteok.com/remote-jobs/remote-revenue-operations-sales-lead-playlab-1129093
Marketing Associate,Mochi Health,"Support, Growth, Voice, Operational, Marketing, Go, Medical, Health, Healthcare",San Francisco,N/A,N/A,https://remoteok.com/remote-jobs/remote-marketing-associate-mochi-health-1129092
Associate Product Designer,Mochi Health,"Designer, Growth, Operational, Medical, Health, Healthcare, Engineering",San Francisco,N/A,N/A,https://remoteok.com/remote-jobs/remote-associate-product-designer-mochi-health-1129091
Senior Application Engineer,InfStones,"Web3, System, Technical, Software, Growth, Code, DevOps, Cloud, Node, Leader, Management, Lead, Senior, Junior, Engineer, Engineering, Backend, Full-Time",Texas,Full-time,N/A,https://remoteok.com/remote-jobs/remote-senior-application-engineer-infstones-1129086
Associate Machine Learning Engineer Trust & Safety Intelligence,Spotify,"Support, Operations, Engineer","New York, NY",N/A,N/A,https://remoteok.com/remote-jobs/remote-associate-machine-learning-engineer-trust-safety-intelligence-spotify-1129085
Graphic Designer Contract to Perm,Monad Foundation,"Ethereum, System, Designer, Technical, Animation, Lead, Full-Time",Probably worldwide,Full-time,N/A,https://remoteok.com/remote-jobs/remote-graphic-designer-contract-to-perm-monad-foundation-1129060
UX Researcher,Trammell Venture Partners,UX,Upgrade to Premium to see salary,N/A,N/A,https://remoteok.com/remote-jobs/remote-ux-researcher-trammell-venture-partners-1129059
Customer Growth Lead Americas,Immutable,"Growth, Web3, Ethereum, Game, Gaming, Consulting, Support, Leader, Strategy, Lead, Health, Recruitment",Probably worldwide,N/A,N/A,https://remoteok.com/remote-jobs/remote-customer-growth-lead-americas-immutable-1129058
Senior Software Engineer Agentic Assistant,Flock Safety,"Software, Assistant, System, Security, Full-Stack, Technical, Recruiter, Testing, UI, UX, Web, Cloud, PostgreSQL, Typescript, Node, API, Senior, Excel, Sales, Reliability, Health, Engineer, Engineering, Backend",Probably worldwide,N/A,N/A,https://remoteok.com/remote-jobs/remote-senior-software-engineer-agentic-assistant-flock-safety-1129046
Staff Engineer Team Lead Market Data,Alpaca,"Crypto, Technical, Financial, Investment, C, API, Lead, Engineer",Remote - Europe - North America,N/A,N/A,https://remoteok.com/remote-jobs/remote-staff-engineer-team-lead-market-data-alpaca-1129044
Institutional Sales Representative Wealth & Asset Management,Anchorage Digital,"Crypto, Security, Growth, Financial, Finance, Bank, Strategy, Management, Operations, Legal, Sales, Executive",United States,N/A,N/A,https://remoteok.com/remote-jobs/remote-institutional-sales-representative-wealth-amp-asset-management-anchorage-digital-1129042
Vice President Project Delivery,Avalere Health,"Training, Support, Growth, Financial, Finance, Leader, Management, Senior, Operational, Marketing, Medical, Health, Healthcare",Probably worldwide,N/A,N/A,https://remoteok.com/remote-jobs/remote-vice-president-project-delivery-avalere-health-1129041
Lead Narrative Designer Design Hybrid,Firesprite,"Training, Game, Designer, Testing, Director, Management, Lead",United Kingdom,N/A,N/A,https://remoteok.com/remote-jobs/remote-lead-narrative-designer-design-hybrid-firesprite-1129027
Principal Engineer Asp.Net,WISEcode,"Embedded, System, Front-End, Security, Teach, Full-Stack, Founder, Cto, Architect, Technical, Strategist, Developer, Growth, UI, Cloud, API, Leader, Strategy, Senior, Reliability, Engineer, Engineering",United States,N/A,N/A,https://remoteok.com/remote-jobs/remote-principal-engineer-asp-net-wisecode-1129022
Senior Software Engineer Integrations,Jobgether,"Software, System, Security, Technical, Support, Code, Web, Lead, Senior, Junior, Healthcare, Engineer, Engineering",Probably worldwide,N/A,N/A,https://remoteok.com/remote-jobs/remote-senior-software-engineer-integrations-jobgether-1129020
DevOps Engineer,HappyCo,"Security, Developer, DevOps, Cloud, PostgreSQL, Mobile, Management, Operations, Reliability, Golang, Engineer, Engineering, Recruitment, Linux, Educational, Backend",Canada,N/A,N/A,https://remoteok.com/remote-jobs/remote-devops-engineer-happyco-1129015
Intern Software Development,Netomi,"Software, Technical, Code, Web, Java, Management, Backend",Remote - India,Internship,N/A,https://remoteok.com/remote-jobs/remote-intern-software-development-netomi-1129012
Web Designer,Wing Assistant,"Web, Virtual Assistant, Designer, Support, Testing, Growth, UX, Assistant, SEO, Senior, Marketing, Analytics, Sales",Columbia,N/A,N/A,https://remoteok.com/remote-jobs/remote-web-designer-wing-assistant-1129011
Lead Product Designer Hybrid,Weedmaps,"iOS, Designer, Mobile, Strategy, Lead, Android","Austin, TX",N/A,N/A,https://remoteok.com/remote-jobs/remote-lead-product-designer-hybrid-weedmaps-1129000
Staff Software Engineer Full Stack & AI Systems,Sully.ai,"Software, System, Front End, Python, Full-Stack, Architect, Test, UI, Cloud, API, Admin, Healthcare, Engineer, Engineering",Probably worldwide,N/A,N/A,https://remoteok.com/remote-jobs/remote-staff-software-engineer-full-stack-ai-systems-sully-ai-1128998
Full Stack Engineer Developer Portal,Helius,"Developer, Web3, React, System, Front End, Security, Full-Stack, Technical, Support, Code, Web, DevOps, API, Lead, Senior, Engineer, Backend",Probably worldwide,N/A,N/A,https://remoteok.com/remote-jobs/remote-full-stack-engineer-developer-portal-helius-1128980
Data Engineer Revenue Platform,Spotify,"System, Python, Music, Technical, Support, Code, Financial, Finance, Cloud, Scala, Operations, Operational, Engineer, Engineering, Recruitment, Backend",London,N/A,N/A,https://remoteok.com/remote-jobs/remote-data-engineer-revenue-platform-spotify-1128972
Senior Technical Product Manager AvaCloud,Ava Labs,"Manager, Web3, Technical, Growth, Senior, Marketing","Brooklyn, NY",N/A,N/A,https://remoteok.com/remote-jobs/remote-senior-technical-product-manager-avacloud-ava-labs-1128965
Intern Software Development,Netomi,"Software, Technical, Code, Web, Java, Management, Backend",Remote - India,Internship,N/A,https://remoteok.com/remote-jobs/remote-intern-software-development-netomi-1128963
Senior Product Designer,Nansen.ai,"Crypto, System, Designer, Testing, Senior, Analytics","Remote Europe, Remote Asia",N/A,N/A,https://remoteok.com/remote-jobs/remote-senior-product-designer-nansen-ai-1128960
Senior Full Stack Software Engineer Design Systems,Circle.so,"Software, Full-Stack, Senior, Operations, Engineer",Upgrade to Premium to see salary,N/A,N/A,https://remoteok.com/remote-jobs/remote-senior-full-stack-software-engineer-design-systems-circle-so-1128955
Staff Software Engineer Core Trading,Alpaca,"Software, Crypto, System, Technical, Code, Financial, Investment, C, API, Lead, Engineer",Remote - APAC,N/A,N/A,https://remoteok.com/remote-jobs/remote-staff-software-engineer-core-trading-alpaca-1128951
Frontend Engineer,"Manta Network, Powered by p0x labs","Front End, Web3, React, UI, Web, Engineer",Any,N/A,N/A,https://remoteok.com/remote-jobs/remote-frontend-engineer-manta-network-powered-by-p0x-labs-1128950
Full Stack Software Engineer,CompassX Group,"Software, React, Front End, Full-Stack, Architect, Technical, Support, Growth, Code, Lead, Junior, Engineer, Backend",Remote - CST Timezone,N/A,N/A,https://remoteok.com/remote-jobs/remote-full-stack-software-engineer-compassx-group-1128948
Technical Project Manager,Tether Operations Limited,"Manager, Bitcoin, System, Security, Technical, Support, Software, Testing, Test, Growth, Code, DevOps, Financial, Fintech, API, Leader, Management, Lead, Ops, Recruitment",Probably worldwide,N/A,N/A,https://remoteok.com/remote-jobs/remote-technical-project-manager-tether-operations-limited-1128945
Senior Motion Designer,Hook,"3d, Training, Designer, Technical, Growth, Video, Animation, Post-Production, Lead, Content, Senior, Junior",Upgrade to Premium to see salary,N/A,N/A,https://remoteok.com/remote-jobs/remote-senior-motion-designer-hook-1128940
Senior Release Engineer,Uniswap Labs,"Defi, Crypto, Ethereum, Architect, Technical, Testing, Web, Mobile, Senior, Health, Engineer, Engineering",New York,N/A,N/A,https://remoteok.com/remote-jobs/remote-senior-release-engineer-uniswap-labs-1128939
Sr Staff Environment Artist,PlayStation Global,"3d, Game, Technical, Software, Testing, Leader, Management, Senior",Los Angeles,N/A,N/A,https://remoteok.com/remote-jobs/remote-sr-staff-environment-artist-playstation-global-1128931
Enterprise Account Executive,Lumivero,"Game, Technical, Software, Leader, Management, Lead, Operational, Sales, Executive",United Kingdom,N/A,N/A,https://remoteok.com/remote-jobs/remote-enterprise-account-executive-lumivero-1128928
Senior Designer,Hook,"Designer, Technical, Senior",Upgrade to Premium to see salary,N/A,N/A,https://remoteok.com/remote-jobs/remote-senior-designer-hook-1128920
Member of Marketing Asia,Anchorage Digital,"Crypto, Security, Growth, Financial, Finance, Fintech, Bank, Strategy, Management, Junior, Marketing, Legal, Sales, Recruiting",Singapore,N/A,N/A,https://remoteok.com/remote-jobs/remote-member-of-marketing-asia-anchorage-digital-1128919
Content Strategist,Capgemini,"Training, Strategist, Support, Testing, Financial, Microsoft, Leader, Strategy, Management, Content, Operations, Health, Engineering",Chennai,N/A,N/A,https://remoteok.com/remote-jobs/remote-content-strategist-capgemini-1128906
Senior Product Designer,Nansen.ai,"Crypto, System, Designer, Testing, Senior, Analytics","Remote Europe, Remote Asia",N/A,N/A,https://remoteok.com/remote-jobs/remote-senior-product-designer-nansen-ai-1128898
UX Researcher Mixed Methods,Linda Werner & Associates,"UX, Testing, SEO, Lead, Senior",Menlo Park,N/A,N/A,https://remoteok.com/remote-jobs/remote-ux-researcher-mixed-methods-linda-werner-associates-1128897
Brand Designer,Sage,"System, Designer, Software, Web, Senior",New York,N/A,N/A,https://remoteok.com/remote-jobs/remote-brand-designer-sage-1128895
Senior Javascript Fullstack Engineer,Filevine,"System, Technical, Web, JavaScript, API, Senior, Legal, Engineer, Engineering, Fullstack, Full-Time",United States,Full-time,N/A,https://remoteok.com/remote-jobs/remote-senior-javascript-fullstack-engineer-filevine-1128894
Product Manager,Crux,"Manager, System, Support, Strategy, Engineering",Probably worldwide,N/A,N/A,https://remoteok.com/remote-jobs/remote-product-manager-crux-1128890
Associate US Market Access,Avalere Health,"Training, Consulting, Support, Growth, Manager, Microsoft, Content, Marketing, Excel, Medical, Health, Healthcare, Full-Time",Washington DC,Full-time,N/A,https://remoteok.com/remote-jobs/remote-associate-us-market-access-avalere-health-1128882
Market Researcher Product Marketing,OpenAI,"Security, Strategy, Lead, Marketing, Excel, Analytics",Probably worldwide,N/A,N/A,https://remoteok.com/remote-jobs/remote-market-researcher-product-marketing-openai-1128879
Data Engineer,Sagent,"Cloud, Engineer",Upgrade to Premium to see salary,N/A,N/A,https://remoteok.com/remote-jobs/remote-data-engineer-sagent-1128878
Fullstack Software Engineer,ARB Interactive,"Software, React, Front-End, Front End, Security, Game, Gaming, Code, Web, Quality Assurance, Banking, Serverless, Cloud, Lead, Recruiting, Engineer, Engineering, Recruitment, Backend, Fullstack",Miami,N/A,N/A,https://remoteok.com/remote-jobs/remote-fullstack-software-engineer-arb-interactive-1128877
Senior Product Data Scientist,Wealthsimple,"Crypto, Support, Growth, Code, Financial, Investment, Fintech, Strategy, Lead, Senior, Analytics, Health, Engineering",Upgrade to Premium to see salary,N/A,N/A,https://remoteok.com/remote-jobs/remote-senior-product-data-scientist-wealthsimple-1128874
Director of Payments U.S. Canada,Banyan Software,"Developer, Director, Embedded, Software, Growth, Financial, Finance, Fintech, Strategy, Management, Lead, Legal",Toronto,N/A,N/A,https://remoteok.com/remote-jobs/remote-director-of-payments-u-s-canada-banyan-software-1128873
Senior Environment Concept Artist Contract,ArenaNet,"VFX, Game, Support, Developer, Lead, Senior, Photoshop",Upgrade to Premium to see salary,Contract,N/A,https://remoteok.com/remote-jobs/remote-senior-environment-concept-artist-contract-arenanet-1128872
Senior Creature Concept Artist Contract,ArenaNet,"Game, Developer, Lead, Senior, Photoshop",Upgrade to Premium to see salary,Contract,N/A,https://remoteok.com/remote-jobs/remote-senior-creature-concept-artist-contract-arenanet-1128871
Social Media Manager,Highsnobiety,"Manager, Support, Travel, Video, Management, Content",Berlin,N/A,N/A,https://remoteok.com/remote-jobs/remote-social-media-manager-highsnobiety-1128868
Business Analyst R01557177,Brillio,"Analyst, System, Consultant, Testing, Test, Strategy, Management, Analytics","Toronto, Ontario, Canada",N/A,N/A,https://remoteok.com/remote-jobs/remote-business-analyst-r01557177-brillio-1128865
Senior Data Engineer Reporting,Adyen,"Technical, Support, Software, Code, Financial, Microsoft, Senior, Excel, Engineer, Engineering",Bengaluru,N/A,N/A,https://remoteok.com/remote-jobs/remote-senior-data-engineer-reporting-adyen-1128863
Mid level Full Stack Engineer HRPS PK,Smart Working Solutions,"HR, System, Front-End, Back-End, Full-Stack, Technical, Support, Developer, Software, Testing, Growth, UX, Code, Payroll, DevOps, Reliability, Engineer, Engineering, Backend",Probably worldwide,N/A,N/A,https://remoteok.com/remote-jobs/remote-mid-level-full-stack-engineer-hrps-pk-smart-working-solutions-1128858
Distribution Designer,Jobgether,"Designer, Technical, Support, Management, Engineering",Probably worldwide,N/A,N/A,https://remoteok.com/remote-jobs/remote-distribution-designer-jobgether-1128856
Project Manager Design Build Construction,Foth,"Manager, Consulting, Support, Testing, Growth, Travel, Leader, Management, Lead, Recruiting, Engineer, Engineering, Full-Time, Part-Time","Green Bay, Wisconsin",Full-time,N/A,https://remoteok.com/remote-jobs/remote-project-manager-design-build-construction-foth-1128847
SEO Specialist,QuillBot,"Students, Technical, Growth, Web, JavaScript, SEO, Strategy, Content, Marketing, Engineering",India,N/A,N/A,https://remoteok.com/remote-jobs/remote-seo-specialist-quillbot-1128844
Frontend Tech Lead,AirDNA,"Front End, React, Training, Full-Stack, Technical, Support, Developer, Software, Financial, Edu, Investment, API, Leader, Management, Lead, Junior, Engineer, Engineering, Backend",Upgrade to Premium to see salary,N/A,N/A,https://remoteok.com/remote-jobs/remote-frontend-tech-lead-airdna-1128840
Software Engineer Engineering Productivity,Reliable Robotics,"Software, React, System, Python, Technical, Support, Test, UX, Code, Web, Travel, Cloud, Robotics, Management, Senior, Engineer, Engineering",Upgrade to Premium to see salary,N/A,N/A,https://remoteok.com/remote-jobs/remote-software-engineer-engineering-productivity-reliable-robotics-1128839
Senior Environment Artist Contract,ArenaNet,"VFX, Game, Support, Developer, Lead, Senior, Photoshop",Upgrade to Premium to see salary,Contract,N/A,https://remoteok.com/remote-jobs/remote-senior-environment-artist-contract-arenanet-1128837
Director Global Training and Development,Celerion,"Training, Director, Technical, Growth, Travel, Adult, Leader, Strategy, Management, Lead, Content, Analytics, Educational",Remote - US,N/A,N/A,https://remoteok.com/remote-jobs/remote-director-global-training-and-development-celerion-1128831
Application Security Engineer,Gensyn,"Security, Web3, Crypto, Web, Strategy, Engineer",Upgrade to Premium to see salary,N/A,N/A,https://remoteok.com/remote-jobs/remote-application-security-engineer-gensyn-1128825
Senior iOS Developer,Web Summit,"iOS, Developer, Web Developer, Swift, Architect, UI, UX, Web, Mobile, Senior, Excel, Engineering",Barcelona,N/A,N/A,https://remoteok.com/remote-jobs/remote-senior-ios-developer-web-summit-1128815
Member of Technical Staff Trading,Anchorage Digital,"Crypto, Cryptocurrency, GraphQL, System, Security, Technical, Software, Test, Growth, Code, Financial, Finance, Bank, Cloud, MySQL, PostgreSQL, API, Management, Lead, Legal, Engineer, Engineering",United States,N/A,N/A,https://remoteok.com/remote-jobs/remote-member-of-technical-staff-trading-anchorage-digital-1128806
Lead Network Engineer Arista & Fortinet SME,New Era Technology,"Security, Architect, Cloud, Lead, Senior, Engineer",Upgrade to Premium to see salary,N/A,N/A,https://remoteok.com/remote-jobs/remote-lead-network-engineer-arista-fortinet-sme-new-era-technology-1128802
Senior Full Stack Developer .Net and Angular,Ubiminds,"Developer, Amazon, HR, System, Front-End, Front End, Technical, Recruiter, Support, Software, Testing, Growth, Code, Web, Quality Assurance, Typescript, Angular, Senior, Reliability, Engineer, Engineering, Recruitment, Backend, Full-Time",Latin America,Full-time,N/A,https://remoteok.com/remote-jobs/remote-senior-full-stack-developer-net-and-angular-ubiminds-1128797
Director Data Engineering,Revinate,"Director, HR, Security, Technical, Recruiter, Support, Happiness, Growth, Java, Cloud, API, Management, Lead, Operations, Operational, Marketing, Analytics, Engineering","Atlanta, GA",N/A,N/A,https://remoteok.com/remote-jobs/remote-director-data-engineering-revinate-1128793
Director of Total Rewards,Rocketship Public Schools,"Director, HR, System, Teacher, Students, Support, Financial, Edu, Finance, Leader, Strategy, Management, Lead, Senior, Marketing, Excel, Health, Executive",Upgrade to Premium to see salary,N/A,N/A,https://remoteok.com/remote-jobs/remote-director-of-total-rewards-rocketship-public-schools-1128789
Marketing & Content Manager,Scale to Win,"Manager, Support, Management, Content, Marketing, Sales","Remote, USA",N/A,N/A,https://remoteok.com/remote-jobs/remote-marketing-content-manager-scale-to-win-1128780
Software Engineer,Character Bio,"Software, Front End, Django, Technical, Support, Web, Cloud, Content, Healthcare, Engineer, Full-Time",Probably worldwide,Full-time,N/A,https://remoteok.com/remote-jobs/remote-software-engineer-character-bio-1128772
Lead Designer,RegScale,"Security, Designer, Leader, Strategy, Lead",Upgrade to Premium to see salary,N/A,N/A,https://remoteok.com/remote-jobs/remote-lead-designer-regscale-1128754
Technical Product Manager,bloXroute Labs,"Manager, Defi, Technical, API, Strategy, Management, Analytics","New York, New York",N/A,N/A,https://remoteok.com/remote-jobs/remote-technical-product-manager-bloxroute-labs-1128736
